,method,source,native,parents,p_value,description,intersection_size
127,DT_score_c45,GO:CC,GO:0005681,"['GO:0140513', 'GO:1990904']",0.010601404948670162,"""Any of a series of ribonucleoprotein complexes that contain snRNA(s) and small nuclear ribonucleoproteins (snRNPs), and are formed sequentially during the spliceosomal splicing of one or more substrate RNAs, and which also contain the RNA substrate(s) from the initial target RNAs of splicing, the splicing intermediate RNA(s), to the final RNA products. During cis-splicing, the initial target RNA is a single, contiguous RNA transcript, whether mRNA, snoRNA, etc., and the released products are a spliced RNA and an excised intron, generally as a lariat structure. During trans-splicing, there are two initial substrate RNAs, the spliced leader RNA and a pre-mRNA."" [GOC:editors, GOC:mah, ISBN:0198547684, PMID:19239890]",7
128,DT_score_c45,HPA,HPA:0570781,['HPA:0570000'],0.010812968183342254,testis; preleptotene spermatocytes[≥Low],29
129,DT_score_c45,GO:BP,GO:0071103,['GO:0051276'],0.01083476261109844,"""A cellular process that results in a change in the spatial configuration of a DNA molecule. A conformation change can bend DNA, or alter the, twist, writhe, or linking number of a DNA molecule."" [GOC:mah]",6
130,DT_score_c45,TF,TF:M09812,['TF:M00000'],0.010895780525402755,Factor: MYC; motif: NNCCACGTGCNN,49
131,DT_score_c45,HPA,HPA:0050000,['HPA:0000000'],0.011201169515197337,breast,69
132,DT_score_c45,GO:BP,GO:0090304,"['GO:0006139', 'GO:0043170']",0.011365844637815497,"""Any cellular metabolic process involving nucleic acids."" [GOC:dph, GOC:tb]",56
133,DT_score_c45,REAC,REAC:R-HSA-168274,['REAC:R-HSA-168255'],0.011949836073223977,Export of Viral Ribonucleoproteins from Nucleus,4
134,DT_score_c45,HPA,HPA:0461471,['HPA:0460000'],0.011980452817748068,skin 1; lymphocytes[≥Low],16
135,DT_score_c45,GO:BP,GO:0010467,['GO:0009059'],0.01210502100600674,"""The process in which a gene's sequence is converted into a mature gene product (protein or RNA). This includes the production of an RNA transcript and its processing, as well as translation and maturation for protein-coding genes."" [GOC:txnOH-2018, PMID:25934543, PMID:31580950]",64
136,DT_score_c45,HPA,HPA:0620223,['HPA:0620222'],0.012386641242169502,vagina; squamous epithelial cells[High],21
137,DT_score_c45,HPA,HPA:0461461,['HPA:0460000'],0.012814664131291585,skin 1; langerhans cells[≥Low],16
138,DT_score_c45,HPA,HPA:0100000,['HPA:0000000'],0.012906395826004245,cerebral cortex,74
139,DT_score_c45,GO:BP,GO:0000027,"['GO:0022618', 'GO:0042255', 'GO:0042273']",0.01343438711029106,"""The aggregation, arrangement and bonding together of constituent RNAs and proteins to form the large ribosomal subunit."" [GOC:jl, PMID:30467428]",4
140,DT_score_c45,HPA,HPA:0570812,['HPA:0570811'],0.013558055796211492,testis; spermatogonia cells[≥Medium],35
141,DT_score_c45,REAC,REAC:R-HSA-180746,['REAC:R-HSA-177243'],0.013658588919090013,Nuclear import of Rev protein,4
142,DT_score_c45,REAC,REAC:R-HSA-159227,['REAC:R-HSA-159234'],0.013658588919090013,Transport of the SLBP independent Mature mRNA,4
143,DT_score_c45,REAC,REAC:R-HSA-180910,['REAC:R-HSA-176033'],0.013658588919090013,Vpr-mediated nuclear import of PICs,4
144,DT_score_c45,GO:MF,GO:0005515,['GO:0005488'],0.013745231752108223,"""Binding to a protein."" [GOC:go_curators]",88
145,DT_score_c45,HPA,HPA:0610832,['HPA:0610831'],0.015037277750587075,urinary bladder; urothelial cells[≥Medium],61
146,DT_score_c45,HPA,HPA:0471491,['HPA:0470000'],0.015136354941597492,skin 2; vascular mural cells[≥Low],9
147,DT_score_c45,REAC,REAC:R-HSA-165054,"['REAC:R-HSA-162599', 'REAC:R-HSA-177243']",0.015539747943248052,Rev-mediated nuclear export of HIV RNA,4
148,DT_score_c45,REAC,REAC:R-HSA-4085377,['REAC:R-HSA-3108232'],0.015539747943248052,SUMOylation of SUMOylation proteins,4
149,DT_score_c45,REAC,REAC:R-HSA-159230,['REAC:R-HSA-159234'],0.015539747943248052,Transport of the SLBP Dependant Mature mRNA,4
150,DT_score_c45,GO:MF,GO:0044877,['GO:0005488'],0.016028791485480167,"""Binding to a macromolecular complex."" [GOC:jl]",22
151,DT_score_c45,GO:CC,GO:0070545,"['GO:0005730', 'GO:0030686', 'GO:0140513']",0.016545108855477254,"""A protein complex that is involved in coordinating ribosome biogenesis with cell cycle progression. In human, it is composed of Pes1, Bop1, and WDR12; in Saccharomyces the proteins are known as Nop7p, Erb1 and Ytm1 respectively."" [GOC:ab, GOC:mah, PMID:16043514, PMID:17353269]",2
152,DT_score_c45,HPA,HPA:0460000,['HPA:0000000'],0.016774159482858448,skin 1,69
153,DT_score_c45,HPA,HPA:0130000,['HPA:0000000'],0.017101597395884884,colon,75
154,DT_score_c45,TF,TF:M02070_1,['TF:M02070'],0.0173267123183629,Factor: TEL1; motif: CNCGGAANNN; match class: 1,45
155,DT_score_c45,REAC,REAC:R-HSA-3301854,['REAC:R-HSA-2980766'],0.017603796261285644,Nuclear Pore Complex (NPC) Disassembly,4
156,DT_score_c45,GO:CC,GO:1904949,['GO:1902494'],0.017677159040227836,"""A protein complex which is capable of ATPase activity."" [GO_REF:0000088, GOC:bhm, GOC:TermGenie, PMID:9606181]",6
157,DT_score_c45,GO:BP,GO:0000470,"['GO:0006364', 'GO:0042273']",0.018271002796404288,"""Any process involved in the maturation of a precursor Large SubUnit (LSU) ribosomal RNA (rRNA) molecule into a mature LSU-rRNA molecule."" [GOC:curators]",4
158,DT_score_c45,TF,TF:M09814,['TF:M00000'],0.018292903362656345,Factor: MYCN; motif: NNCCACGTGGNN,26
159,DT_score_c45,TF,TF:M09814_1,['TF:M09814'],0.018292903362656345,Factor: MYCN; motif: NNCCACGTGGNN; match class: 1,26
160,DT_score_c45,GO:CC,GO:0043034,"['GO:0030016', 'GO:0110165']",0.018683582243550396,"""Regular periodic sub membranous arrays of vinculin in skeletal and cardiac muscle cells, these arrays link Z-discs to the sarcolemma and are associated with links to extracellular matrix."" [GOC:jl, GOC:mtg_muscle, ISBN:0198506732, PMID:6405378]",3
161,DT_score_c45,HPA,HPA:0040083,['HPA:0040082'],0.018742054273768054,bone marrow; hematopoietic cells[High],24
162,DT_score_c45,HPA,HPA:0630000,['HPA:0000000'],0.018752046433786085,cervix,67
163,DT_score_c45,TF,TF:M00539,['TF:M00000'],0.018963892462673913,Factor: Arnt; motif: NNNNNRTCACGTGAYNNNNN,55
164,DT_score_c45,TF,TF:M00539_1,['TF:M00539'],0.018963892462673913,Factor: Arnt; motif: NNNNNRTCACGTGAYNNNNN; match class: 1,55
165,DT_score_c45,HPA,HPA:0471492,['HPA:0471491'],0.01905507309472727,skin 2; vascular mural cells[≥Medium],8
166,DT_score_c45,TF,TF:M01181,['TF:M00000'],0.01959705299508209,Factor: Nkx3-2; motif: TRAGTG,69
167,DT_score_c45,REAC,REAC:R-HSA-176033,['REAC:R-HSA-162909'],0.019861436233021747,Interactions of Vpr with host cellular proteins,4
168,DT_score_c45,REAC,REAC:R-HSA-177243,['REAC:R-HSA-162909'],0.019861436233021747,Interactions of Rev with host cellular proteins,4
169,DT_score_c45,REAC,REAC:R-HSA-3371453,['REAC:R-HSA-3371556'],0.02001542282572466,Regulation of HSF1-mediated heat shock response,5
170,DT_score_c45,GO:BP,GO:0006396,"['GO:0010467', 'GO:0016070']",0.020451000389401536,"""Any process involved in the conversion of one or more primary RNA transcripts into one or more mature RNA molecules."" [GOC:mah]",33
171,DT_score_c45,HPA,HPA:0301361,['HPA:0300000'],0.021528946229025413,lung; alveolar cells type I[≥Low],20
172,DT_score_c45,GO:BP,GO:0034641,"['GO:0006807', 'GO:0044237']",0.02153649540196892,"""The chemical reactions and pathways involving various organic and inorganic nitrogenous compounds, as carried out by individual cells."" [GOC:mah]",61
173,DT_score_c45,HPA,HPA:0461412,['HPA:0461411'],0.022124152378685622,skin 1; cells in spinous layer[≥Medium],14
174,DT_score_c45,REAC,REAC:R-HSA-3232142,['REAC:R-HSA-3108232'],0.022323582344600974,SUMOylation of ubiquitinylation proteins,4
175,DT_score_c45,HPA,HPA:0590051,['HPA:0590000'],0.023654122051143877,thyroid gland; glandular cells[≥Low],68
176,DT_score_c45,HPA,HPA:0590000,['HPA:0000000'],0.023654122051143877,thyroid gland,68
177,DT_score_c45,HPA,HPA:0460671,['HPA:0460000'],0.023845705082329156,skin 1; melanocytes[≥Low],56
178,DT_score_c45,HPA,HPA:0170052,['HPA:0170051'],0.024187144256881964,endometrium 2; glandular cells[≥Medium],53
179,DT_score_c45,GO:BP,GO:0015931,"['GO:0071702', 'GO:0071705']",0.024236195866805376,"""The directed movement of nucleobases, nucleosides, nucleotides and nucleic acids, into, out of or within a cell, or between cells, by means of some agent such as a transporter or pore."" [GOC:ai]",8
180,DT_score_c45,HPA,HPA:0600221,['HPA:0600000'],0.024833828774792698,tonsil; squamous epithelial cells[≥Low],65
181,DT_score_c45,HPA,HPA:0080133,['HPA:0080132'],0.025064039793333978,caudate; neuronal cells[High],20
182,DT_score_c45,TF,TF:M11090,['TF:M00000'],0.025492475427488802,Factor: TFEA; motif: YRCACGTGACN,52
183,DT_score_c45,GO:BP,GO:0051292,"['GO:0006999', 'GO:0046931']",0.02573011686544065,"""The aggregation, arrangement and bonding together of a set of components to form a nuclear pore complex."" [GOC:ai, GOC:mah]",3
184,DT_score_c45,TF,TF:M04743_1,['TF:M04743'],0.026474207082335475,Factor: c-Myc; motif: NSCACGTGGN; match class: 1,33
185,DT_score_c45,REAC,REAC:R-HSA-159236,['REAC:R-HSA-72202'],0.02649096502913686,Transport of Mature mRNA derived from an Intron-Containing Transcript,5
186,DT_score_c45,TF,TF:M00118,['TF:M00000'],0.02707717375972775,Factor: c-Myc:Max; motif: NNACCACGTGGTNN,56
187,DT_score_c45,TF,TF:M00118_1,['TF:M00118'],0.02707717375972775,Factor: c-Myc:Max; motif: NNACCACGTGGTNN; match class: 1,56
188,DT_score_c45,HPA,HPA:0471412,['HPA:0471411'],0.02766303927576116,skin 2; cells in spinous layer[≥Medium],15
189,DT_score_c45,GO:BP,GO:0006359,"['GO:0006355', 'GO:0006383']",0.027784985849847885,"""Any process that modulates the frequency, rate or extent of transcription mediated by RNA ploymerase III."" [GOC:go_curators]",4
190,DT_score_c45,REAC,REAC:R-HSA-3108232,['REAC:R-HSA-2990846'],0.027794778130581257,SUMO E3 ligases SUMOylate target proteins,7
191,DT_score_c45,GO:CC,GO:0005737,"['GO:0005622', 'GO:0110165']",0.029252588745651675,"""The contents of a cell excluding the plasma membrane and nucleus, but including other subcellular structures."" [ISBN:0198547684]",73
192,DT_score_c45,TF,TF:M07601,['TF:M00000'],0.030505251533803842,Factor: C-Myc; motif: NGCCACGTGNN,50
193,DT_score_c45,GO:MF,GO:0140640,['GO:0003824'],0.030876069645734344,"""Catalytic activity that acts to modify a nucleic acid."" [GOC:pg]",12
194,DT_score_c45,REAC,REAC:R-HSA-168276,['REAC:R-HSA-168255'],0.031049237844530616,NS1 Mediated Effects on Host Pathways,4
195,DT_score_c45,REAC,REAC:R-HSA-159231,['REAC:R-HSA-159234'],0.031049237844530616,Transport of Mature mRNA Derived from an Intronless Transcript,4
196,DT_score_c45,HPA,HPA:0380000,['HPA:0000000'],0.032025927046133065,placenta,70
197,DT_score_c45,HPA,HPA:0461413,['HPA:0461412'],0.03217965666784178,skin 1; cells in spinous layer[High],8
198,DT_score_c45,GO:BP,GO:0071840,['GO:0009987'],0.032660630069129636,"""A process that results in the biosynthesis of constituent macromolecules, assembly, arrangement of constituent parts, or disassembly of a cellular component."" [GOC:mah]",59
199,DT_score_c45,HPA,HPA:0500701,['HPA:0500000'],0.03360504528919901,soft tissue 1; peripheral nerve[≥Low],36
200,DT_score_c45,TF,TF:M09876_1,['TF:M09876'],0.034028760321481714,Factor: DEC1; motif: NGCACGTGAS; match class: 1,52
201,DT_score_c45,REAC,REAC:R-HSA-159234,['REAC:R-HSA-72202'],0.03444255285346302,Transport of Mature mRNAs Derived from Intronless Transcripts,4
202,DT_score_c45,HPA,HPA:0470682,['HPA:0470681'],0.03479718104621815,skin 2; epidermal cells[≥Medium],46
203,DT_score_c45,HPA,HPA:0500000,['HPA:0000000'],0.035184143580205975,soft tissue 1,56
204,DT_score_c45,HPA,HPA:0470000,['HPA:0000000'],0.03678596183583692,skin 2,67
205,DT_score_c45,REAC,REAC:R-HSA-168325,['REAC:R-HSA-168273'],0.03809788677102757,Viral Messenger RNA Synthesis,4
206,DT_score_c45,CORUM,CORUM:3055,['CORUM:0000000'],0.03851250844056905,Nop56p-associated pre-rRNA complex,7
207,DT_score_c45,HPA,HPA:0471411,['HPA:0470000'],0.03860489912176771,skin 2; cells in spinous layer[≥Low],17
208,DT_score_c45,HPA,HPA:0170051,['HPA:0170000'],0.03875092454028184,endometrium 2; glandular cells[≥Low],65
209,DT_score_c45,WP,WP:WP4932,['WP:000000'],0.040072651086384636,7q11 23 copy number variation syndrome,5
210,DT_score_c45,HPA,HPA:0471461,['HPA:0470000'],0.040205414158207456,skin 2; langerhans cells[≥Low],16
211,DT_score_c45,HPA,HPA:0471391,['HPA:0470000'],0.040685967363322084,skin 2; cells in basal layer[≥Low],18
212,DT_score_c45,TF,TF:M08950,['TF:M00000'],0.042091224455764506,Factor: MAX; motif: CACGTG,50
213,DT_score_c45,TF,TF:M08950_1,['TF:M08950'],0.042091224455764506,Factor: MAX; motif: CACGTG; match class: 1,50
214,DT_score_c45,TF,TF:M00726,['TF:M00000'],0.042091224455764506,Factor: USF2; motif: CASGYG,50
215,DT_score_c45,TF,TF:M00726_1,['TF:M00726'],0.042091224455764506,Factor: USF2; motif: CASGYG; match class: 1,50
216,DT_score_c45,HPA,HPA:0090962,['HPA:0090961'],0.04230143560875373,cerebellum; Purkinje cells - nucleus[≥Medium],6
217,DT_score_c45,HPA,HPA:0320852,['HPA:0320851'],0.04310746023246166,nasopharynx; ciliated cells (cell body)[≥Medium],17
218,DT_score_c45,GO:BP,GO:0006406,"['GO:0006405', 'GO:0010467', 'GO:0051028']",0.04358243324291092,"""The directed movement of mRNA from the nucleus to the cytoplasm."" [GOC:ma]",5
219,DT_score_c45,WP,WP:WP5352,['WP:000000'],0.04401043209537405,10q11 21q11 23 copy number variation syndrome,4
220,DT_score_c45,HPA,HPA:0320841,['HPA:0320000'],0.045585803328924875,nasopharynx; basal cells[≥Low],14
221,DT_score_c45,HPA,HPA:0461463,['HPA:0461462'],0.04594996340401072,skin 1; langerhans cells[High],8
222,DT_score_c45,TF,TF:M00615_1,['TF:M00615'],0.04607705352109105,Factor: c-Myc:Max; motif: NNNNNNNCACGTGNNNNNNN; match class: 1,54
223,DT_score_c45,TF,TF:M00615,['TF:M00000'],0.04607705352109105,Factor: c-Myc:Max; motif: NNNNNNNCACGTGNNNNNNN,54
224,DT_score_c45,REAC,REAC:R-HSA-72202,['REAC:R-HSA-72203'],0.04692715191094302,Transport of Mature Transcript to Cytoplasm,5
225,DT_score_c45,HPA,HPA:0350000,['HPA:0000000'],0.04752825251977943,pancreas,69
226,DT_score_c45,HPA,HPA:0471471,['HPA:0470000'],0.04852104722679222,skin 2; lymphocytes[≥Low],16
227,RandomForest_gini,GO:BP,GO:0006364,"['GO:0016072', 'GO:0034470', 'GO:0042254']",8.006798273130736e-33,"""Any process involved in the conversion of a primary ribosomal RNA (rRNA) transcript into one or more mature rRNA molecules."" [GOC:curators]",30
228,RandomForest_gini,GO:BP,GO:0042254,['GO:0022613'],1.403592877158249e-32,"""A cellular process that results in the biosynthesis of constituent macromolecules, assembly, and arrangement of constituent parts of ribosome subunits; includes transport to the sites of protein synthesis."" [GOC:ma, PMID:26404467, Wikipedia:Ribosome_biogenesis]",33
229,RandomForest_gini,GO:BP,GO:0016072,['GO:0034660'],1.199189212000548e-30,"""The chemical reactions and pathways involving rRNA, ribosomal RNA, a structural constituent of ribosomes."" [ISBN:0198506732]",30
230,RandomForest_gini,GO:CC,GO:0030684,['GO:1990904'],1.3826784939389583e-30,"""Any complex of pre-rRNAs, ribosomal proteins, and associated proteins formed during ribosome biogenesis."" [PMID:10567516]",23
231,RandomForest_gini,GO:BP,GO:0034470,"['GO:0006396', 'GO:0034660']",2.6347745523280232e-25,"""Any process that results in the conversion of one or more primary non-coding RNA (ncRNA) transcripts into one or more mature ncRNA molecules."" [GOC:mah, PMID:27573892]",31
232,RandomForest_gini,GO:BP,GO:0034660,['GO:0016070'],8.995312165216479e-23,"""The chemical reactions and pathways involving non-coding RNA transcripts (ncRNAs)."" [GOC:mah]",33
233,RandomForest_gini,REAC,REAC:R-HSA-8868773,['REAC:R-HSA-72312'],9.69677182126236e-21,rRNA processing in the nucleus and cytosol,23
234,RandomForest_gini,REAC,REAC:R-HSA-72312,['REAC:R-HSA-8953854'],3.201200030487119e-20,rRNA processing,23
235,RandomForest_gini,REAC,REAC:R-HSA-6791226,['REAC:R-HSA-8868773'],2.3847915657451055e-18,Major pathway of rRNA processing in the nucleolus and cytosol,21
236,RandomForest_gini,REAC,REAC:R-HSA-8953854,['REAC:0000000'],3.345807225767944e-18,Metabolism of RNA,33
237,RandomForest_gini,GO:BP,GO:0000470,"['GO:0006364', 'GO:0042273']",4.758716692818755e-16,"""Any process involved in the maturation of a precursor Large SubUnit (LSU) ribosomal RNA (rRNA) molecule into a mature LSU-rRNA molecule."" [GOC:curators]",11
238,RandomForest_gini,GO:BP,GO:0042273,"['GO:0022613', 'GO:0042254']",6.759364471077293e-16,"""A cellular process that results in the biosynthesis of constituent macromolecules, assembly, and arrangement of constituent parts of a large ribosomal subunit; includes transport to the sites of protein synthesis."" [GOC:jl]",14
239,RandomForest_gini,GO:MF,GO:0003723,['GO:0003676'],2.5655822696565693e-14,"""Binding to an RNA molecule or a portion thereof."" [GOC:jl, GOC:mah]",51
240,RandomForest_gini,GO:CC,GO:0032040,['GO:0030684'],1.0562501293287516e-13,"""A large ribonucleoprotein complex that is an early preribosomal complex. In S. cerevisiae, it has a size of 80S and consists of the 35S pre-rRNA, early-associating ribosomal proteins most of which are part of the small ribosomal subunit, the U3 snoRNA and associated proteins."" [GOC:krc, GOC:vw, PMID:12068309, PMID:12957375, PMID:15120992, PMID:15590835]",12
241,RandomForest_gini,GO:CC,GO:0005730,"['GO:0031981', 'GO:0043232']",2.980810361998818e-13,"""A small, dense body one or more of which are present in the nucleus of eukaryotic cells. It is rich in RNA and protein, is not bounded by a limiting membrane, and is not seen during mitosis. Its prime function is the transcription of the nucleolar DNA into 45S ribosomal-precursor RNA, the processing of this RNA into 5.8S, 18S, and 28S components of ribosomal RNA, and the association of these components with 5S RNA and proteins synthesized outside the nucleolus. This association results in the formation of ribonucleoprotein precursors; these pass into the cytoplasm and mature into the 40S and 60S subunits of the ribosome."" [ISBN:0198506732]",38
242,RandomForest_gini,REAC,REAC:R-HSA-6790901,['REAC:R-HSA-8868773'],9.717442292090805e-13,rRNA modification in the nucleus and cytosol,12
243,RandomForest_gini,GO:CC,GO:0030687,['GO:0030684'],2.1067266246287602e-12,"""A preribosomal complex consisting of 27SA, 27SB, and/or 7S pre-rRNA, 5S rRNA, ribosomal proteins including late-associating large subunit proteins, and associated proteins; a precursor of the eukaryotic cytoplasmic large ribosomal subunit."" [PMID:10567516]",8
244,RandomForest_gini,GO:CC,GO:0030686,['GO:0030684'],4.2465919049488316e-11,"""A large ribonucleoprotein complex considered to be the earliest preribosomal complex. In S. cerevisiae, it has a size of 90S and consists of the 35S pre-rRNA, early-associating ribosomal proteins most of which are part of the small ribosomal subunit, the U3 snoRNA and associated proteins."" [GOC:krc, GOC:vw, PMID:12150911, PMID:12957375, PMID:15120992]",8
245,RandomForest_gini,GO:BP,GO:0022613,['GO:0044085'],5.684180671718312e-11,"""A cellular process that results in the biosynthesis of constituent macromolecules, assembly, and arrangement of constituent parts of a complex containing RNA and proteins. Includes the biosynthesis of the constituent RNA and protein molecules, and those macromolecular modifications that are involved in synthesis or assembly of the ribonucleoprotein complex."" [GOC:isa_complete, GOC:mah]",36
246,RandomForest_gini,KEGG,KEGG:03008,['KEGG:00000'],7.797709060327708e-11,Ribosome biogenesis in eukaryotes,13
247,RandomForest_gini,GO:BP,GO:0042274,"['GO:0022613', 'GO:0042254']",8.18631737237966e-11,"""A cellular process that results in the biosynthesis of constituent macromolecules, assembly, and arrangement of constituent parts of a small ribosomal subunit; includes transport to the sites of protein synthesis."" [GOC:jl]",12
248,RandomForest_gini,GO:CC,GO:0043233,"['GO:0031974', 'GO:0043226']",9.050028601286825e-11,"""The internal volume enclosed by the membranes of a particular organelle; includes the volume enclosed by a single organelle membrane, e.g. endoplasmic reticulum lumen, or the volume enclosed by the innermost of the two lipid bilayers of an organelle envelope, e.g. nuclear lumen."" [GOC:jl, GOC:mah]",64
249,RandomForest_gini,GO:CC,GO:0070013,"['GO:0043229', 'GO:0043233']",9.050028601286825e-11,"""An organelle lumen that is part of an intracellular organelle."" [GOC:mah]",64
250,RandomForest_gini,GO:CC,GO:0031974,['GO:0110165'],9.050028601286825e-11,"""The enclosed volume within a sealed membrane or between two sealed membranes. Encompasses the volume enclosed by the membranes of a particular organelle, e.g. endoplasmic reticulum lumen, or the space between the two lipid bilayers of a double membrane surrounding an organelle, e.g. nuclear envelope lumen."" [GOC:add, GOC:mah]",64
251,RandomForest_gini,GO:BP,GO:0000463,['GO:0000470'],8.704912436543869e-10,"""Any process involved in the maturation of a precursor Large SubUnit (LSU) ribosomal RNA (rRNA) molecule into a mature LSU-rRNA molecule from the pre-rRNA molecule originally produced as a tricistronic rRNA transcript that contains the Small Subunit (SSU) rRNA, 5.8S rRNA, and Large Subunit (LSU) in that order from 5' to 3' along the primary transcript."" [GOC:curators]",7
252,RandomForest_gini,GO:CC,GO:0031981,"['GO:0005634', 'GO:0070013']",1.8792154289742317e-09,"""The volume enclosed by the nuclear inner membrane."" [GOC:mah, GOC:pz]",56
253,RandomForest_gini,GO:BP,GO:0044085,['GO:0071840'],3.028240924108536e-09,"""A process that results in the biosynthesis of constituent macromolecules, assembly, and arrangement of constituent parts of a cellular component. Includes biosynthesis of constituent macromolecules, and those macromolecular modifications that are involved in synthesis or assembly of the cellular component."" [GOC:jl, GOC:mah]",55
254,RandomForest_gini,HPA,HPA:0400242,['HPA:0400241'],1.7463667572449377e-07,rectum; peripheral nerve/ganglion[≥Medium],13
255,RandomForest_gini,GO:CC,GO:0005654,"['GO:0031981', 'GO:0110165']",2.490551259752805e-07,"""That part of the nuclear content other than the chromosomes or the nucleolus."" [GOC:ma, ISBN:0124325653]",45
256,RandomForest_gini,GO:BP,GO:0071840,['GO:0009987'],4.012338501168293e-07,"""A process that results in the biosynthesis of constituent macromolecules, assembly, arrangement of constituent parts, or disassembly of a cellular component."" [GOC:mah]",69
257,RandomForest_gini,HPA,HPA:0400243,['HPA:0400242'],1.4163500036970396e-06,rectum; peripheral nerve/ganglion[High],10
258,RandomForest_gini,GO:CC,GO:1990904,['GO:0032991'],3.282145940611672e-06,"""A macromolecular complex that contains both RNA and protein molecules."" [GOC:krc, GOC:vesicles]",34
259,RandomForest_gini,GO:MF,GO:0003676,['GO:0097159'],3.4005089069112035e-06,"""Binding to a nucleic acid."" [GOC:jl]",54
260,RandomForest_gini,GO:MF,GO:0030515,['GO:0003723'],6.504741805049343e-06,"""Binding to a small nucleolar RNA."" [GOC:mah]",6
261,RandomForest_gini,GO:CC,GO:0110016,"['GO:0005730', 'GO:0070603']",6.806358460966811e-06,"""A chromatin remodeling complex that positively regulates histone H3 acetylation, in particular H3K9, by recruiting histone acetyltransferases to rDNA gene regions. Located in the nucleolus where it assembles on RNA Polymerase I (Pol I) and possibly on RNA Polymerase III (Pol III) promoter and coding regions during early G1 phase and activates the post-initiation phases of Pol I transcription. May also activate RNA Polymerase II (Pol II) gene transcription. In mammals, B-WICH contains the WICH complex core of BAZ1B and SMARCA5, additional protein subunits and possibly rRNAs. Although it contains several catalytic subunits it is not clear which functions are carried out by the complex itself."" [GOC:bhm, PMID:16603771, PMID:21559432, PMID:23555303, PMID:26044184]",4
262,RandomForest_gini,HPA,HPA:0400241,['HPA:0400000'],6.8794403514897935e-06,rectum; peripheral nerve/ganglion[≥Low],13
263,RandomForest_gini,GO:BP,GO:0030490,"['GO:0006364', 'GO:0042274']",8.907413783558239e-06,"""Any process involved in the maturation of a precursor Small SubUnit (SSU) ribosomal RNA (rRNA) molecule into a mature SSU-rRNA molecule."" [GOC:curators]",7
264,RandomForest_gini,GO:CC,GO:0043232,"['GO:0043228', 'GO:0043229']",9.059814548525818e-06,"""Organized structure of distinctive morphology and function, not bounded by a lipid bilayer membrane and occurring within the cell. Includes ribosomes, the cytoskeleton and chromosomes."" [GOC:go_curators]",55
265,RandomForest_gini,GO:CC,GO:0043228,['GO:0043226'],9.112168948065004e-06,"""Organized structure of distinctive morphology and function, not bounded by a lipid bilayer membrane. Includes ribosomes, the cytoskeleton and chromosomes."" [GOC:go_curators]",55
266,RandomForest_gini,HPA,HPA:0091011,['HPA:0090000'],1.7018369628065245e-05,cerebellum; molecular layer cells - nucleus[≥Low],11
267,RandomForest_gini,GO:CC,GO:0070545,"['GO:0005730', 'GO:0030686', 'GO:0140513']",2.3164467850578967e-05,"""A protein complex that is involved in coordinating ribosome biogenesis with cell cycle progression. In human, it is composed of Pes1, Bop1, and WDR12; in Saccharomyces the proteins are known as Nop7p, Erb1 and Ytm1 respectively."" [GOC:ab, GOC:mah, PMID:16043514, PMID:17353269]",3
268,RandomForest_gini,GO:BP,GO:0045943,"['GO:0006356', 'GO:0006360', 'GO:0045893']",2.6817896449470473e-05,"""Any process that activates or increases the frequency, rate or extent of transcription mediated by RNA polymerase I."" [GOC:go_curators, GOC:txnOH]",6
269,RandomForest_gini,GO:BP,GO:0000460,['GO:0006364'],3.2063522107773026e-05,"""Any process involved in the maturation of a precursor 5.8S ribosomal RNA (rRNA) molecule into a mature 5.8S rRNA molecule."" [GOC:curators]",6
