,method,source,native,parents,p_value,description,intersection_size
408,multi_Lasso,GO:BP,GO:0042254,['GO:0022613'],7.526688179854889e-18,"""A cellular process that results in the biosynthesis of constituent macromolecules, assembly, and arrangement of constituent parts of ribosome subunits; includes transport to the sites of protein synthesis."" [GOC:ma, PMID:26404467, Wikipedia:Ribosome_biogenesis]",23
409,multi_Lasso,GO:BP,GO:0034470,"['GO:0006396', 'GO:0034660']",7.434333329648348e-15,"""Any process that results in the conversion of one or more primary non-coding RNA (ncRNA) transcripts into one or more mature ncRNA molecules."" [GOC:mah, PMID:27573892]",23
410,multi_Lasso,GO:BP,GO:0034660,['GO:0016070'],2.249608439641089e-13,"""The chemical reactions and pathways involving non-coding RNA transcripts (ncRNAs)."" [GOC:mah]",25
411,multi_Lasso,REAC,REAC:R-HSA-8868773,['REAC:R-HSA-72312'],3.749439935860609e-12,rRNA processing in the nucleus and cytosol,17
412,multi_Lasso,REAC,REAC:R-HSA-72312,['REAC:R-HSA-8953854'],8.762728249620085e-12,rRNA processing,17
413,multi_Lasso,GO:BP,GO:0000470,"['GO:0006364', 'GO:0042273']",9.430310386713032e-12,"""Any process involved in the maturation of a precursor Large SubUnit (LSU) ribosomal RNA (rRNA) molecule into a mature LSU-rRNA molecule."" [GOC:curators]",9
414,multi_Lasso,GO:MF,GO:0003723,['GO:0003676'],2.5059252525613234e-11,"""Binding to an RNA molecule or a portion thereof."" [GOC:jl, GOC:mah]",47
415,multi_Lasso,GO:CC,GO:0030686,['GO:0030684'],4.2465919049488316e-11,"""A large ribonucleoprotein complex considered to be the earliest preribosomal complex. In S. cerevisiae, it has a size of 90S and consists of the 35S pre-rRNA, early-associating ribosomal proteins most of which are part of the small ribosomal subunit, the U3 snoRNA and associated proteins."" [GOC:krc, GOC:vw, PMID:12150911, PMID:12957375, PMID:15120992]",8
416,multi_Lasso,GO:BP,GO:0042273,"['GO:0022613', 'GO:0042254']",9.786102025133474e-11,"""A cellular process that results in the biosynthesis of constituent macromolecules, assembly, and arrangement of constituent parts of a large ribosomal subunit; includes transport to the sites of protein synthesis."" [GOC:jl]",11
417,multi_Lasso,REAC,REAC:R-HSA-6791226,['REAC:R-HSA-8868773'],4.796502587770201e-10,Major pathway of rRNA processing in the nucleolus and cytosol,15
418,multi_Lasso,GO:BP,GO:0000463,['GO:0000470'],8.95214304721698e-10,"""Any process involved in the maturation of a precursor Large SubUnit (LSU) ribosomal RNA (rRNA) molecule into a mature LSU-rRNA molecule from the pre-rRNA molecule originally produced as a tricistronic rRNA transcript that contains the Small Subunit (SSU) rRNA, 5.8S rRNA, and Large Subunit (LSU) in that order from 5' to 3' along the primary transcript."" [GOC:curators]",7
419,multi_Lasso,REAC,REAC:R-HSA-72203,['REAC:R-HSA-8953854'],1.4581067633069443e-09,Processing of Capped Intron-Containing Pre-mRNA,17
420,multi_Lasso,GO:CC,GO:0031981,"['GO:0005634', 'GO:0070013']",7.679365187901605e-09,"""The volume enclosed by the nuclear inner membrane."" [GOC:mah, GOC:pz]",55
421,multi_Lasso,GO:CC,GO:0070013,"['GO:0043229', 'GO:0043233']",2.7358046561594346e-08,"""An organelle lumen that is part of an intracellular organelle."" [GOC:mah]",60
422,multi_Lasso,GO:CC,GO:0031974,['GO:0110165'],2.7358046561594346e-08,"""The enclosed volume within a sealed membrane or between two sealed membranes. Encompasses the volume enclosed by the membranes of a particular organelle, e.g. endoplasmic reticulum lumen, or the space between the two lipid bilayers of a double membrane surrounding an organelle, e.g. nuclear envelope lumen."" [GOC:add, GOC:mah]",60
423,multi_Lasso,GO:CC,GO:0043233,"['GO:0031974', 'GO:0043226']",2.7358046561594346e-08,"""The internal volume enclosed by the membranes of a particular organelle; includes the volume enclosed by a single organelle membrane, e.g. endoplasmic reticulum lumen, or the volume enclosed by the innermost of the two lipid bilayers of an organelle envelope, e.g. nuclear lumen."" [GOC:jl, GOC:mah]",60
424,multi_Lasso,GO:CC,GO:0005730,"['GO:0031981', 'GO:0043232']",5.8591107829454184e-08,"""A small, dense body one or more of which are present in the nucleus of eukaryotic cells. It is rich in RNA and protein, is not bounded by a limiting membrane, and is not seen during mitosis. Its prime function is the transcription of the nucleolar DNA into 45S ribosomal-precursor RNA, the processing of this RNA into 5.8S, 18S, and 28S components of ribosomal RNA, and the association of these components with 5S RNA and proteins synthesized outside the nucleolus. This association results in the formation of ribonucleoprotein precursors; these pass into the cytoplasm and mature into the 40S and 60S subunits of the ribosome."" [ISBN:0198506732]",31
425,multi_Lasso,GO:CC,GO:0005684,['GO:0005681'],7.53245430458679e-08,"""Any spliceosomal complex that forms during the splicing of a messenger RNA primary transcript to excise an intron that has canonical consensus sequences near the 5' and 3' ends."" [GOC:krc, GOC:mah, PMID:11343900]",9
426,multi_Lasso,HPA,HPA:0400243,['HPA:0400242'],1.1209337857782669e-07,rectum; peripheral nerve/ganglion[High],11
427,multi_Lasso,HPA,HPA:0400242,['HPA:0400241'],2.4793166269512957e-07,rectum; peripheral nerve/ganglion[≥Medium],13
428,multi_Lasso,GO:CC,GO:0032040,['GO:0030684'],3.086954317726297e-07,"""A large ribonucleoprotein complex that is an early preribosomal complex. In S. cerevisiae, it has a size of 80S and consists of the 35S pre-rRNA, early-associating ribosomal proteins most of which are part of the small ribosomal subunit, the U3 snoRNA and associated proteins."" [GOC:krc, GOC:vw, PMID:12068309, PMID:12957375, PMID:15120992, PMID:15590835]",8
429,multi_Lasso,GO:CC,GO:0005681,"['GO:0140513', 'GO:1990904']",4.935996926352524e-07,"""Any of a series of ribonucleoprotein complexes that contain snRNA(s) and small nuclear ribonucleoproteins (snRNPs), and are formed sequentially during the spliceosomal splicing of one or more substrate RNAs, and which also contain the RNA substrate(s) from the initial target RNAs of splicing, the splicing intermediate RNA(s), to the final RNA products. During cis-splicing, the initial target RNA is a single, contiguous RNA transcript, whether mRNA, snoRNA, etc., and the released products are a spliced RNA and an excised intron, generally as a lariat structure. During trans-splicing, there are two initial substrate RNAs, the spliced leader RNA and a pre-mRNA."" [GOC:editors, GOC:mah, ISBN:0198547684, PMID:19239890]",11
430,multi_Lasso,GO:CC,GO:0071005,"['GO:0005684', 'GO:0071011']",6.096930629416367e-07,"""A spliceosomal complex that is formed by the recruitment of the preassembled U4/U6.U5 tri-snRNP to the prespliceosome. Although all 5 snRNPs are present, the precatalytic spliceosome is catalytically inactive. The precatalytic spliceosome includes many proteins in addition to those found in the U1, U2 and U4/U6.U5 snRNPs."" [GOC:ab, GOC:krc, GOC:mah, PMID:18322460, PMID:19239890]",7
431,multi_Lasso,WP,WP:WP411,['WP:000000'],7.394194331513739e-07,mRNA processing,10
432,multi_Lasso,GO:CC,GO:0071011,['GO:0005681'],8.108115595501009e-07,"""A spliceosomal complex that is formed by the recruitment of a preassembled U5-containing tri-snRNP to the prespliceosome. Although all 5 snRNPs are present, the precatalytic spliceosome is catalytically inactive. The precatalytic spliceosome includes many proteins in addition to those found in the associated snRNPs."" [GOC:ab, GOC:krc, GOC:mah, PMID:18322460, PMID:19239890]",7
433,multi_Lasso,GO:CC,GO:0005654,"['GO:0031981', 'GO:0110165']",9.159980266890948e-07,"""That part of the nuclear content other than the chromosomes or the nucleolus."" [GOC:ma, ISBN:0124325653]",44
434,multi_Lasso,GO:MF,GO:0017056,['GO:0005198'],1.306488770445727e-06,"""The action of a molecule that contributes to the structural integrity of the nuclear pore complex, a protein-lined channel in the nuclear envelope that allows the transfer of macromolecules."" [GOC:mah, PMID:25802992]",6
435,multi_Lasso,KEGG,KEGG:03008,['KEGG:00000'],1.8558430052359784e-06,Ribosome biogenesis in eukaryotes,10
436,multi_Lasso,REAC,REAC:R-HSA-6790901,['REAC:R-HSA-8868773'],2.2821082572251667e-06,rRNA modification in the nucleus and cytosol,8
437,multi_Lasso,GO:CC,GO:1990904,['GO:0032991'],3.282145940611672e-06,"""A macromolecular complex that contains both RNA and protein molecules."" [GOC:krc, GOC:vesicles]",34
438,multi_Lasso,GO:BP,GO:0006403,['GO:0033036'],4.1265427146464775e-06,"""A process in which RNA is transported to, or maintained in, a specific location."" [GOC:ai]",11
439,multi_Lasso,GO:CC,GO:0030687,['GO:0030684'],4.594949565038975e-06,"""A preribosomal complex consisting of 27SA, 27SB, and/or 7S pre-rRNA, 5S rRNA, ribosomal proteins including late-associating large subunit proteins, and associated proteins; a precursor of the eukaryotic cytoplasmic large ribosomal subunit."" [PMID:10567516]",5
440,multi_Lasso,GO:BP,GO:0050658,"['GO:0050657', 'GO:0051236']",7.0189200831480435e-06,"""The directed movement of RNA, ribonucleic acids, into, out of or within a cell, or between cells, by means of some agent such as a transporter or pore."" [GOC:ai]",10
441,multi_Lasso,GO:BP,GO:0050657,['GO:0015931'],7.0189200831480435e-06,"""The directed movement of nucleic acids, single or double-stranded polynucleotides involved in the storage, transmission and transfer of genetic information, into, out of or within a cell, or between cells, by means of some agent such as a transporter or pore."" [GOC:ai, ISBN:0198506732]",10
442,multi_Lasso,GO:BP,GO:0051236,"['GO:0006403', 'GO:0051234']",8.422475637566213e-06,"""The directed movement of RNA to a specific location."" [GOC:ai]",10
443,multi_Lasso,GO:BP,GO:0022613,['GO:0044085'],8.719661008971492e-06,"""A cellular process that results in the biosynthesis of constituent macromolecules, assembly, and arrangement of constituent parts of a complex containing RNA and proteins. Includes the biosynthesis of the constituent RNA and protein molecules, and those macromolecular modifications that are involved in synthesis or assembly of the ribonucleoprotein complex."" [GOC:isa_complete, GOC:mah]",29
444,multi_Lasso,HPA,HPA:0091052,['HPA:0091051'],9.54956363182959e-06,cerebellum; synaptic glomeruli - capsule[≥Medium],8
445,multi_Lasso,HPA,HPA:0400241,['HPA:0400000'],9.654242902923054e-06,rectum; peripheral nerve/ganglion[≥Low],13
446,multi_Lasso,REAC,REAC:R-HSA-5619107,['REAC:R-HSA-5619102'],1.1395086957556573e-05,Defective TPR may confer susceptibility towards thyroid papillary carcinoma (TPC),6
447,multi_Lasso,REAC,REAC:R-HSA-170822,['REAC:R-HSA-70171'],1.1395086957556573e-05,Regulation of Glucokinase by Glucokinase Regulatory Protein,6
448,multi_Lasso,GO:BP,GO:0006999,"['GO:0006997', 'GO:0043933']",1.237448070902274e-05,"""A process that is carried out at the cellular level which results in the assembly, arrangement of constituent parts, or disassembly of the nuclear pore."" [GOC:dph, GOC:jid, GOC:jl, GOC:mah]",5
449,multi_Lasso,REAC,REAC:R-HSA-168333,['REAC:R-HSA-168274'],1.4289360209175987e-05,NEP/NS2 Interacts with the Cellular Export Machinery,6
450,multi_Lasso,REAC,REAC:R-HSA-168271,['REAC:R-HSA-168255'],1.4289360209175987e-05,Transport of Ribonucleoproteins into the Host Nucleus,6
451,multi_Lasso,KEGG,KEGG:03040,['KEGG:00000'],1.5697608291590278e-05,Spliceosome,10
452,multi_Lasso,GO:BP,GO:0044085,['GO:0071840'],1.616467894799099e-05,"""A process that results in the biosynthesis of constituent macromolecules, assembly, and arrangement of constituent parts of a cellular component. Includes biosynthesis of constituent macromolecules, and those macromolecular modifications that are involved in synthesis or assembly of the cellular component."" [GOC:jl, GOC:mah]",49
453,multi_Lasso,GO:CC,GO:0016604,"['GO:0005654', 'GO:0110165']",1.687701084530991e-05,"""Extra-nucleolar nuclear domains usually visualized by confocal microscopy and fluorescent antibodies to specific proteins."" [GOC:ma, PMID:10330182]",18
454,multi_Lasso,REAC,REAC:R-HSA-168274,['REAC:R-HSA-168255'],1.7764290396013468e-05,Export of Viral Ribonucleoproteins from Nucleus,6
455,multi_Lasso,GO:BP,GO:0051028,['GO:0050658'],1.784244489066512e-05,"""The directed movement of mRNA, messenger ribonucleic acid, into, out of or within a cell, or between cells, by means of some agent such as a transporter or pore."" [GOC:ai]",9
456,multi_Lasso,REAC,REAC:R-HSA-194441,['REAC:R-HSA-8953854'],1.9739414247703883e-05,Metabolism of non-coding RNA,7
457,multi_Lasso,REAC,REAC:R-HSA-191859,['REAC:R-HSA-194441'],1.9739414247703883e-05,snRNP Assembly,7
458,multi_Lasso,REAC,REAC:R-HSA-180746,['REAC:R-HSA-177243'],2.1907595057189343e-05,Nuclear import of Rev protein,6
459,multi_Lasso,REAC,REAC:R-HSA-159227,['REAC:R-HSA-159234'],2.1907595057189343e-05,Transport of the SLBP independent Mature mRNA,6
460,multi_Lasso,REAC,REAC:R-HSA-180910,['REAC:R-HSA-176033'],2.1907595057189343e-05,Vpr-mediated nuclear import of PICs,6
461,multi_Lasso,GO:CC,GO:0070545,"['GO:0005730', 'GO:0030686', 'GO:0140513']",2.3164467850578967e-05,"""A protein complex that is involved in coordinating ribosome biogenesis with cell cycle progression. In human, it is composed of Pes1, Bop1, and WDR12; in Saccharomyces the proteins are known as Nop7p, Erb1 and Ytm1 respectively."" [GOC:ab, GOC:mah, PMID:16043514, PMID:17353269]",3
462,multi_Lasso,REAC,REAC:R-HSA-165054,"['REAC:R-HSA-162599', 'REAC:R-HSA-177243']",2.6816159477974763e-05,Rev-mediated nuclear export of HIV RNA,6
463,multi_Lasso,REAC,REAC:R-HSA-4085377,['REAC:R-HSA-3108232'],2.6816159477974763e-05,SUMOylation of SUMOylation proteins,6
464,multi_Lasso,REAC,REAC:R-HSA-159230,['REAC:R-HSA-159234'],2.6816159477974763e-05,Transport of the SLBP Dependant Mature mRNA,6
465,multi_Lasso,REAC,REAC:R-HSA-3301854,['REAC:R-HSA-2980766'],3.259658396215277e-05,Nuclear Pore Complex (NPC) Disassembly,6
466,multi_Lasso,GO:CC,GO:0071013,"['GO:0005681', 'GO:1902494']",3.6595519606371464e-05,"""A spliceosomal complex that contains three snRNPs, including U5, bound to a splicing intermediate in which the first catalytic cleavage of the 5' splice site has occurred. The precise subunit composition differs significantly from that of the catalytic step 1, or activated, spliceosome, and includes many proteins in addition to those found in the associated snRNPs."" [GOC:ab, GOC:krc, GOC:mah, ISBN:0879695897, ISBN:0879697393, PMID:18322460, PMID:19239890]",7
467,multi_Lasso,REAC,REAC:R-HSA-176033,['REAC:R-HSA-162909'],3.936573812496111e-05,Interactions of Vpr with host cellular proteins,6
468,multi_Lasso,REAC,REAC:R-HSA-177243,['REAC:R-HSA-162909'],3.936573812496111e-05,Interactions of Rev with host cellular proteins,6
469,multi_Lasso,HPA,HPA:0090993,['HPA:0090992'],3.9946632696342895e-05,cerebellum; molecular layer - neuropil[High],6
470,multi_Lasso,KEGG,KEGG:03013,['KEGG:00000'],4.302551983474702e-05,Nucleocytoplasmic transport,8
471,multi_Lasso,REAC,REAC:R-HSA-72163,['REAC:R-HSA-72172'],4.7183837992025155e-05,mRNA Splicing - Major Pathway,11
472,multi_Lasso,REAC,REAC:R-HSA-3232142,['REAC:R-HSA-3108232'],4.72513215460848e-05,SUMOylation of ubiquitinylation proteins,6
473,multi_Lasso,GO:CC,GO:0005643,"['GO:0005635', 'GO:0140513']",6.631005386402719e-05,"""A protein complex providing a discrete opening in the nuclear envelope of a eukaryotic cell, where the inner and outer nuclear membranes are joined."" [ISBN:0198547684]",7
474,multi_Lasso,CORUM,CORUM:351,['CORUM:0000000'],6.655265093440509e-05,Spliceosome,11
475,multi_Lasso,REAC,REAC:R-HSA-72172,['REAC:R-HSA-72203'],6.667852609175038e-05,mRNA Splicing,11
476,multi_Lasso,HPA,HPA:0091051,['HPA:0090000'],6.78854932803466e-05,cerebellum; synaptic glomeruli - capsule[≥Low],8
477,multi_Lasso,REAC,REAC:R-HSA-159231,['REAC:R-HSA-159234'],7.90580214274453e-05,Transport of Mature mRNA Derived from an Intronless Transcript,6
478,multi_Lasso,REAC,REAC:R-HSA-168276,['REAC:R-HSA-168255'],7.90580214274453e-05,NS1 Mediated Effects on Host Pathways,6
479,multi_Lasso,GO:CC,GO:0016607,['GO:0016604'],8.695108568505653e-05,"""A discrete extra-nucleolar subnuclear domain, 20-50 in number, in which splicing factors are seen to be localized by immunofluorescence microscopy."" [http://www.cellnucleus.com/]",12
480,multi_Lasso,REAC,REAC:R-HSA-159234,['REAC:R-HSA-72202'],9.29228426000174e-05,Transport of Mature mRNAs Derived from Intronless Transcripts,6
481,multi_Lasso,HPA,HPA:0250133,['HPA:0250132'],9.826672185808636e-05,hippocampus; neuronal cells[High],26
482,multi_Lasso,HPA,HPA:0130652,['HPA:0130651'],0.00010287467536512485,colon; fibroblasts[≥Medium],8
483,multi_Lasso,REAC,REAC:R-HSA-168325,['REAC:R-HSA-168273'],0.00010872502888865537,Viral Messenger RNA Synthesis,6
484,multi_Lasso,GO:MF,GO:0044877,['GO:0005488'],0.00011761434339129449,"""Binding to a macromolecular complex."" [GOC:jl]",26
485,multi_Lasso,HPA,HPA:0091022,['HPA:0091021'],0.00012612747967914842,cerebellum; processes in granular layer[≥Medium],10
486,multi_Lasso,HPA,HPA:0080133,['HPA:0080132'],0.00012701495056886464,caudate; neuronal cells[High],24
487,multi_Lasso,REAC,REAC:R-HSA-4570464,['REAC:R-HSA-3108232'],0.00016987807589864714,SUMOylation of RNA binding proteins,6
488,multi_Lasso,REAC,REAC:R-HSA-4615885,['REAC:R-HSA-3108232'],0.00016987807589864714,SUMOylation of DNA replication proteins,6
489,multi_Lasso,GO:CC,GO:0005694,['GO:0043232'],0.0002026563925747927,"""A structure composed of a very long molecule of DNA and associated proteins (e.g. histones) that carries hereditary information."" [ISBN:0198547684]",25
490,multi_Lasso,REAC,REAC:R-HSA-159236,['REAC:R-HSA-72202'],0.00020310820736615148,Transport of Mature mRNA derived from an Intron-Containing Transcript,7
491,multi_Lasso,HPA,HPA:0130651,['HPA:0130000'],0.00022071748955471325,colon; fibroblasts[≥Low],8
492,multi_Lasso,GO:BP,GO:0015931,"['GO:0071702', 'GO:0071705']",0.00024060497651746439,"""The directed movement of nucleobases, nucleosides, nucleotides and nucleic acids, into, out of or within a cell, or between cells, by means of some agent such as a transporter or pore."" [GOC:ai]",10
493,multi_Lasso,HPA,HPA:0091053,['HPA:0091052'],0.00024942745336865613,cerebellum; synaptic glomeruli - capsule[High],5
494,multi_Lasso,GO:BP,GO:0006396,"['GO:0010467', 'GO:0016070']",0.00029158679371602534,"""Any process involved in the conversion of one or more primary RNA transcripts into one or more mature RNA molecules."" [GOC:mah]",37
495,multi_Lasso,REAC,REAC:R-HSA-2980766,['REAC:R-HSA-68875'],0.00029273327930110936,Nuclear Envelope Breakdown,6
496,multi_Lasso,GO:BP,GO:0030490,"['GO:0006364', 'GO:0042274']",0.000320936388425834,"""Any process involved in the maturation of a precursor Small SubUnit (SSU) ribosomal RNA (rRNA) molecule into a mature SSU-rRNA molecule."" [GOC:curators]",6
497,multi_Lasso,REAC,REAC:R-HSA-72165,['REAC:R-HSA-72172'],0.0003327290850797927,mRNA Splicing - Minor Pathway,6
498,multi_Lasso,GO:CC,GO:0031965,"['GO:0005635', 'GO:0031090']",0.0003370765739440135,"""Either of the lipid bilayers that surround the nucleus and form the nuclear envelope; excludes the intermembrane space."" [GOC:mah, GOC:pz]",10
499,multi_Lasso,GO:BP,GO:0071840,['GO:0009987'],0.00034759246192801534,"""A process that results in the biosynthesis of constituent macromolecules, assembly, arrangement of constituent parts, or disassembly of a cellular component."" [GOC:mah]",64
500,multi_Lasso,HPA,HPA:0460201,['HPA:0460000'],0.0003768266591825749,skin 1; endothelial cells[≥Low],20
501,multi_Lasso,REAC,REAC:R-HSA-72202,['REAC:R-HSA-72203'],0.00046172185724793784,Transport of Mature Transcript to Cytoplasm,7
502,multi_Lasso,GO:BP,GO:0006405,"['GO:0050658', 'GO:0051168']",0.00047811736465937297,"""The directed movement of RNA from the nucleus to the cytoplasm."" [GOC:ma]",7
503,multi_Lasso,HPA,HPA:0091021,['HPA:0090000'],0.00048627250377845016,cerebellum; processes in granular layer[≥Low],10
504,multi_Lasso,CORUM,CORUM:6856,['CORUM:0000000'],0.0005319023909668655,PeBoW complex,3
505,multi_Lasso,CORUM,CORUM:6306,['CORUM:0000000'],0.0005319023909668655,DDX27-PeBoW complex,3
506,multi_Lasso,WP,WP:WP3998,['WP:000000'],0.0007066862083053508,Prader Willi and Angelman syndrome,7
507,multi_Lasso,REAC,REAC:R-HSA-70326,['REAC:R-HSA-71387'],0.0007556085488218942,Glucose metabolism,7
508,multi_Lasso,REAC,REAC:R-HSA-6784531,['REAC:R-HSA-72306'],0.000756529345174109,tRNA processing in the nucleus,6
509,multi_Lasso,HPA,HPA:0470671,['HPA:0470000'],0.0007568745909148851,skin 2; melanocytes[≥Low],18
510,multi_Lasso,GO:CC,GO:0140513,"['GO:0005634', 'GO:0032991']",0.0008172568725348808,"""A stable assembly of two or more macromolecules, i.e. proteins, nucleic acids, carbohydrates or lipids, in which at least one component is a protein and the constituent parts function together in the nucleus."" [GOC:pg]",29
511,multi_Lasso,GO:MF,GO:0005198,['GO:0003674'],0.0008394572819121436,"""The action of a molecule that contributes to the structural integrity of a complex."" [GOC:mah, GOC:vw]",19
512,multi_Lasso,GO:MF,GO:0003676,['GO:0097159'],0.0008860462516310407,"""Binding to a nucleic acid."" [GOC:jl]",49
513,multi_Lasso,GO:BP,GO:0042274,"['GO:0022613', 'GO:0042254']",0.0009786352489621812,"""A cellular process that results in the biosynthesis of constituent macromolecules, assembly, and arrangement of constituent parts of a small ribosomal subunit; includes transport to the sites of protein synthesis."" [GOC:jl]",7
514,multi_Lasso,GO:BP,GO:0045943,"['GO:0006356', 'GO:0006360', 'GO:0045893']",0.0012435810036191873,"""Any process that activates or increases the frequency, rate or extent of transcription mediated by RNA polymerase I."" [GOC:go_curators, GOC:txnOH]",5
515,multi_Lasso,GO:MF,GO:0003729,['GO:0003723'],0.0012529543898169306,"""Binding to messenger RNA (mRNA), an intermediate molecule between DNA and protein. mRNA includes UTR and coding sequences, but does not contain introns."" [GOC:kmv, GOC:pr, SO:0000234]",11
516,multi_Lasso,GO:CC,GO:0110016,"['GO:0005730', 'GO:0070603']",0.0012766526954060753,"""A chromatin remodeling complex that positively regulates histone H3 acetylation, in particular H3K9, by recruiting histone acetyltransferases to rDNA gene regions. Located in the nucleolus where it assembles on RNA Polymerase I (Pol I) and possibly on RNA Polymerase III (Pol III) promoter and coding regions during early G1 phase and activates the post-initiation phases of Pol I transcription. May also activate RNA Polymerase II (Pol II) gene transcription. In mammals, B-WICH contains the WICH complex core of BAZ1B and SMARCA5, additional protein subunits and possibly rRNAs. Although it contains several catalytic subunits it is not clear which functions are carried out by the complex itself."" [GOC:bhm, PMID:16603771, PMID:21559432, PMID:23555303, PMID:26044184]",3
517,multi_Lasso,GO:MF,GO:0043021,['GO:0044877'],0.0013695551167936413,"""Binding to a complex of RNA and protein."" [GOC:bf, GOC:go_curators, GOC:vk]",8
518,multi_Lasso,HPA,HPA:0400653,['HPA:0400652'],0.0014229048556655263,rectum; fibroblasts[High],6
519,multi_Lasso,HPA,HPA:0090000,['HPA:0000000'],0.0014656086648931965,cerebellum,70
520,multi_Lasso,GO:CC,GO:0043232,"['GO:0043228', 'GO:0043229']",0.001689206939237465,"""Organized structure of distinctive morphology and function, not bounded by a lipid bilayer membrane and occurring within the cell. Includes ribosomes, the cytoskeleton and chromosomes."" [GOC:go_curators]",50
521,multi_Lasso,GO:CC,GO:0043228,['GO:0043226'],0.0016971772673800571,"""Organized structure of distinctive morphology and function, not bounded by a lipid bilayer membrane. Includes ribosomes, the cytoskeleton and chromosomes."" [GOC:go_curators]",50
522,multi_Lasso,HPA,HPA:0130243,['HPA:0130242'],0.001969393752585741,colon; peripheral nerve/ganglion[High],19
523,multi_Lasso,REAC,REAC:R-HSA-4551638,['REAC:R-HSA-3108232'],0.002232838019045202,SUMOylation of chromatin organization proteins,6
524,multi_Lasso,REAC,REAC:R-HSA-3371453,['REAC:R-HSA-3371556'],0.002439106638141922,Regulation of HSF1-mediated heat shock response,6
525,multi_Lasso,HPA,HPA:0090992,['HPA:0090991'],0.002441634169519961,cerebellum; molecular layer - neuropil[≥Medium],8
526,multi_Lasso,GO:CC,GO:0071007,"['GO:0005684', 'GO:0071013']",0.0024743751011856037,"""A spliceosomal complex that contains the U2, U5 and U6 snRNPs bound to a splicing intermediate in which the first catalytic cleavage of the 5' splice site has occurred. The precise subunit composition differs significantly from that of the catalytic step 1, or activated, spliceosome, and includes many proteins in addition to those found in the U2, U5 and U6 snRNPs."" [GOC:ab, GOC:krc, GOC:mah, ISBN:0879695897, ISBN:0879697393, PMID:18322460, PMID:19239890]",4
527,multi_Lasso,GO:BP,GO:0051168,['GO:0006913'],0.002634783549440636,"""The directed movement of substances out of the nucleus."" [GOC:ai]",8
528,multi_Lasso,REAC,REAC:R-HSA-70171,['REAC:R-HSA-70326'],0.002660582415427034,Glycolysis,6
529,multi_Lasso,HPA,HPA:0470672,['HPA:0470671'],0.002760541602666092,skin 2; melanocytes[≥Medium],16
530,multi_Lasso,HPA,HPA:0080132,['HPA:0080131'],0.002978379164398285,caudate; neuronal cells[≥Medium],49
531,multi_Lasso,REAC,REAC:R-HSA-1169408,['REAC:R-HSA-1169410'],0.00315254318218558,ISG15 antiviral mechanism,6
532,multi_Lasso,GO:CC,GO:0005635,"['GO:0005634', 'GO:0012505', 'GO:0031967']",0.0032830860201920747,"""The double lipid bilayer enclosing the nucleus and separating its contents from the rest of the cytoplasm; includes the intermembrane space, a gap of width 20-40 nm (also called the perinuclear space)."" [ISBN:0198547684]",11
533,multi_Lasso,HPA,HPA:0470201,['HPA:0470000'],0.0033860033218238543,skin 2; endothelial cells[≥Low],19
