,method,source,native,parents,p_value,description,intersection_size
0,DT_score_c45,GO:CC,GO:0030684,['GO:1990904'],2.439645289447784e-21,"""Any complex of pre-rRNAs, ribosomal proteins, and associated proteins formed during ribosome biogenesis."" [PMID:10567516]",18
1,DT_score_c45,GO:BP,GO:0042254,['GO:0022613'],6.098748546446341e-18,"""A cellular process that results in the biosynthesis of constituent macromolecules, assembly, and arrangement of constituent parts of ribosome subunits; includes transport to the sites of protein synthesis."" [GOC:ma, PMID:26404467, Wikipedia:Ribosome_biogenesis]",23
2,DT_score_c45,GO:BP,GO:0006364,"['GO:0016072', 'GO:0034470', 'GO:0042254']",2.4430151741664475e-14,"""Any process involved in the conversion of a primary ribosomal RNA (rRNA) transcript into one or more mature rRNA molecules."" [GOC:curators]",18
3,DT_score_c45,GO:BP,GO:0016072,['GO:0034660'],4.253593592424783e-13,"""The chemical reactions and pathways involving rRNA, ribosomal RNA, a structural constituent of ribosomes."" [ISBN:0198506732]",18
4,DT_score_c45,GO:BP,GO:0034470,"['GO:0006396', 'GO:0034660']",1.3512872804948064e-12,"""Any process that results in the conversion of one or more primary non-coding RNA (ncRNA) transcripts into one or more mature ncRNA molecules."" [GOC:mah, PMID:27573892]",21
5,DT_score_c45,GO:BP,GO:0034660,['GO:0016070'],2.072086084507205e-12,"""The chemical reactions and pathways involving non-coding RNA transcripts (ncRNAs)."" [GOC:mah]",24
6,DT_score_c45,REAC,REAC:R-HSA-8953854,['REAC:0000000'],2.8593726930569635e-12,Metabolism of RNA,26
7,DT_score_c45,GO:CC,GO:0032040,['GO:0030684'],5.905203543007476e-12,"""A large ribonucleoprotein complex that is an early preribosomal complex. In S. cerevisiae, it has a size of 80S and consists of the 35S pre-rRNA, early-associating ribosomal proteins most of which are part of the small ribosomal subunit, the U3 snoRNA and associated proteins."" [GOC:krc, GOC:vw, PMID:12068309, PMID:12957375, PMID:15120992, PMID:15590835]",11
8,DT_score_c45,GO:CC,GO:0043233,"['GO:0031974', 'GO:0043226']",4.0954778347318725e-11,"""The internal volume enclosed by the membranes of a particular organelle; includes the volume enclosed by a single organelle membrane, e.g. endoplasmic reticulum lumen, or the volume enclosed by the innermost of the two lipid bilayers of an organelle envelope, e.g. nuclear lumen."" [GOC:jl, GOC:mah]",65
9,DT_score_c45,GO:CC,GO:0031974,['GO:0110165'],4.0954778347318725e-11,"""The enclosed volume within a sealed membrane or between two sealed membranes. Encompasses the volume enclosed by the membranes of a particular organelle, e.g. endoplasmic reticulum lumen, or the space between the two lipid bilayers of a double membrane surrounding an organelle, e.g. nuclear envelope lumen."" [GOC:add, GOC:mah]",65
10,DT_score_c45,GO:CC,GO:0070013,"['GO:0043229', 'GO:0043233']",4.0954778347318725e-11,"""An organelle lumen that is part of an intracellular organelle."" [GOC:mah]",65
11,DT_score_c45,GO:CC,GO:0030687,['GO:0030684'],3.719099615454015e-10,"""A preribosomal complex consisting of 27SA, 27SB, and/or 7S pre-rRNA, 5S rRNA, ribosomal proteins including late-associating large subunit proteins, and associated proteins; a precursor of the eukaryotic cytoplasmic large ribosomal subunit."" [PMID:10567516]",7
12,DT_score_c45,GO:CC,GO:0031981,"['GO:0005634', 'GO:0070013']",8.029466719074452e-10,"""The volume enclosed by the nuclear inner membrane."" [GOC:mah, GOC:pz]",57
13,DT_score_c45,REAC,REAC:R-HSA-6791226,['REAC:R-HSA-8868773'],1.0285325892646016e-09,Major pathway of rRNA processing in the nucleolus and cytosol,14
14,DT_score_c45,GO:MF,GO:0003723,['GO:0003676'],1.8544796867319375e-09,"""Binding to an RNA molecule or a portion thereof."" [GOC:jl, GOC:mah]",44
15,DT_score_c45,REAC,REAC:R-HSA-8868773,['REAC:R-HSA-72312'],2.1378053681004198e-09,rRNA processing in the nucleus and cytosol,14
16,DT_score_c45,GO:BP,GO:0042274,"['GO:0022613', 'GO:0042254']",2.6851059100240964e-09,"""A cellular process that results in the biosynthesis of constituent macromolecules, assembly, and arrangement of constituent parts of a small ribosomal subunit; includes transport to the sites of protein synthesis."" [GOC:jl]",11
17,DT_score_c45,REAC,REAC:R-HSA-72312,['REAC:R-HSA-8953854'],4.265649963610112e-09,rRNA processing,14
18,DT_score_c45,REAC,REAC:R-HSA-6790901,['REAC:R-HSA-8868773'],2.330997344067585e-08,rRNA modification in the nucleus and cytosol,9
19,DT_score_c45,GO:CC,GO:0005654,"['GO:0031981', 'GO:0110165']",2.569404236034991e-08,"""That part of the nuclear content other than the chromosomes or the nucleolus."" [GOC:ma, ISBN:0124325653]",47
20,DT_score_c45,GO:CC,GO:0043232,"['GO:0043228', 'GO:0043229']",3.218997671013419e-08,"""Organized structure of distinctive morphology and function, not bounded by a lipid bilayer membrane and occurring within the cell. Includes ribosomes, the cytoskeleton and chromosomes."" [GOC:go_curators]",60
21,DT_score_c45,GO:CC,GO:0043228,['GO:0043226'],3.2408471656491545e-08,"""Organized structure of distinctive morphology and function, not bounded by a lipid bilayer membrane. Includes ribosomes, the cytoskeleton and chromosomes."" [GOC:go_curators]",60
22,DT_score_c45,GO:CC,GO:0005730,"['GO:0031981', 'GO:0043232']",7.876708349442587e-08,"""A small, dense body one or more of which are present in the nucleus of eukaryotic cells. It is rich in RNA and protein, is not bounded by a limiting membrane, and is not seen during mitosis. Its prime function is the transcription of the nucleolar DNA into 45S ribosomal-precursor RNA, the processing of this RNA into 5.8S, 18S, and 28S components of ribosomal RNA, and the association of these components with 5S RNA and proteins synthesized outside the nucleolus. This association results in the formation of ribonucleoprotein precursors; these pass into the cytoplasm and mature into the 40S and 60S subunits of the ribosome."" [ISBN:0198506732]",31
23,DT_score_c45,GO:BP,GO:0042273,"['GO:0022613', 'GO:0042254']",1.3686778861957133e-07,"""A cellular process that results in the biosynthesis of constituent macromolecules, assembly, and arrangement of constituent parts of a large ribosomal subunit; includes transport to the sites of protein synthesis."" [GOC:jl]",9
24,DT_score_c45,GO:BP,GO:0006403,['GO:0033036'],2.4383775859185396e-07,"""A process in which RNA is transported to, or maintained in, a specific location."" [GOC:ai]",12
25,DT_score_c45,GO:CC,GO:0030686,['GO:0030684'],3.967044317674019e-07,"""A large ribonucleoprotein complex considered to be the earliest preribosomal complex. In S. cerevisiae, it has a size of 90S and consists of the 35S pre-rRNA, early-associating ribosomal proteins most of which are part of the small ribosomal subunit, the U3 snoRNA and associated proteins."" [GOC:krc, GOC:vw, PMID:12150911, PMID:12957375, PMID:15120992]",6
26,DT_score_c45,GO:CC,GO:0005694,['GO:0043232'],9.082369769428308e-07,"""A structure composed of a very long molecule of DNA and associated proteins (e.g. histones) that carries hereditary information."" [ISBN:0198547684]",29
27,DT_score_c45,GO:CC,GO:0031428,['GO:0005732'],1.5394462369972649e-06,"""A ribonucleoprotein complex containing a box C/D type RNA that can carry out ribose-2'-O-methylation of target RNAs. Box C/D type RNAs are widespread in eukaryotes and in Archaea, suggesting that an RNA-based guide mechanism for directing specific RNA 2'-O-ribose methylations was present in the common ancestor of Archaea and Eukarya."" [ISBN:0879695897, PMID:11842104, PMID:17284456]",4
28,DT_score_c45,GO:MF,GO:0097159,['GO:0005488'],1.993019166929859e-06,"""Binding to an organic cyclic compound, any molecular entity that contains carbon arranged in a cyclic molecular structure."" [GOC:sjw, PMID:7583672]",65
29,DT_score_c45,GO:MF,GO:0030515,['GO:0003723'],6.113247041249304e-06,"""Binding to a small nucleolar RNA."" [GOC:mah]",6
30,DT_score_c45,GO:CC,GO:0110016,"['GO:0005730', 'GO:0070603']",7.13527217334737e-06,"""A chromatin remodeling complex that positively regulates histone H3 acetylation, in particular H3K9, by recruiting histone acetyltransferases to rDNA gene regions. Located in the nucleolus where it assembles on RNA Polymerase I (Pol I) and possibly on RNA Polymerase III (Pol III) promoter and coding regions during early G1 phase and activates the post-initiation phases of Pol I transcription. May also activate RNA Polymerase II (Pol II) gene transcription. In mammals, B-WICH contains the WICH complex core of BAZ1B and SMARCA5, additional protein subunits and possibly rRNAs. Although it contains several catalytic subunits it is not clear which functions are carried out by the complex itself."" [GOC:bhm, PMID:16603771, PMID:21559432, PMID:23555303, PMID:26044184]",4
31,DT_score_c45,HPA,HPA:0620222,['HPA:0620221'],9.753203320719037e-06,vagina; squamous epithelial cells[≥Medium],54
32,DT_score_c45,HPA,HPA:0620221,['HPA:0620000'],1.7715396484083008e-05,vagina; squamous epithelial cells[≥Low],67
33,DT_score_c45,HPA,HPA:0620000,['HPA:0000000'],1.7715396484083008e-05,vagina,67
34,DT_score_c45,GO:MF,GO:0003676,['GO:0097159'],2.258832258348939e-05,"""Binding to a nucleic acid."" [GOC:jl]",52
35,DT_score_c45,GO:BP,GO:0045943,"['GO:0006356', 'GO:0006360', 'GO:0045893']",2.6817896449470473e-05,"""Any process that activates or increases the frequency, rate or extent of transcription mediated by RNA polymerase I."" [GOC:go_curators, GOC:txnOH]",6
36,DT_score_c45,GO:CC,GO:0005732,['GO:1990904'],2.68640402642931e-05,"""A ribonucleoprotein complex that contains an RNA molecule of the snoRNA family and associated proteins. Many are involved in a step of processing of rRNA molecules: cleavage, 2'-O-methylation, or pseudouridylation, but other RNA types can be targets as well. The majority fall into one of two classes, box C/D type or box H/ACA type, which are conserved across eukaryotes and archaea. Other members include the telomerase RNA and the ribonuclease MRP RNA."" [GOC:krc, GOC:mah, ISBN:0879695897, PMID:17284456]",5
37,DT_score_c45,GO:CC,GO:0140513,"['GO:0005634', 'GO:0032991']",2.7260907776213828e-05,"""A stable assembly of two or more macromolecules, i.e. proteins, nucleic acids, carbohydrates or lipids, in which at least one component is a protein and the constituent parts function together in the nucleus."" [GOC:pg]",32
38,DT_score_c45,REAC,REAC:R-HSA-72203,['REAC:R-HSA-8953854'],2.9426562123845534e-05,Processing of Capped Intron-Containing Pre-mRNA,12
39,DT_score_c45,HPA,HPA:0190222,['HPA:0190221'],5.3069421857699255e-05,esophagus; squamous epithelial cells[≥Medium],60
40,DT_score_c45,HPA,HPA:0630222,['HPA:0630221'],5.908534758710418e-05,cervix; squamous epithelial cells[≥Medium],50
41,DT_score_c45,REAC,REAC:R-HSA-4615885,['REAC:R-HSA-3108232'],7.833814871419041e-05,SUMOylation of DNA replication proteins,6
42,DT_score_c45,GO:CC,GO:0032991,['GO:0005575'],8.582806974959062e-05,"""A stable assembly of two or more macromolecules, i.e. proteins, nucleic acids, carbohydrates or lipids, in which at least one component is a protein and the constituent parts function together."" [GOC:dos, GOC:mah]",63
43,DT_score_c45,HPA,HPA:0330223,['HPA:0330222'],9.202100634049907e-05,oral mucosa; squamous epithelial cells[High],25
44,DT_score_c45,GO:CC,GO:0034399,"['GO:0031981', 'GO:0110165']",0.00011603690192607334,"""The portion of the nuclear lumen proximal to the inner nuclear membrane."" [GOC:krc, GOC:mah]",8
45,DT_score_c45,KEGG,KEGG:03008,['KEGG:00000'],0.00011953176662582056,Ribosome biogenesis in eukaryotes,8
46,DT_score_c45,HPA,HPA:0610000,['HPA:0000000'],0.00013778413619611955,urinary bladder,73
47,DT_score_c45,HPA,HPA:0610831,['HPA:0610000'],0.00013778413619611955,urinary bladder; urothelial cells[≥Low],73
48,DT_score_c45,GO:CC,GO:0005634,['GO:0043231'],0.00015882137733237627,"""A membrane-bounded organelle of eukaryotic cells in which chromosomes are housed and replicated. In most cells, the nucleus contains all of the cell's chromosomes except the organellar chromosomes, and is the site of RNA synthesis and processing. In some species, or in specialized cell types, RNA metabolism or DNA replication may be absent."" [GOC:go_curators]",69
49,DT_score_c45,HPA,HPA:0250132,['HPA:0250131'],0.00016777423783999196,hippocampus; neuronal cells[≥Medium],53
50,DT_score_c45,GO:BP,GO:0006356,"['GO:0006355', 'GO:0006360']",0.0001933012383016667,"""Any process that modulates the frequency, rate or extent of transcription mediated by RNA polymerase I."" [GOC:go_curators]",6
51,DT_score_c45,HPA,HPA:0190223,['HPA:0190222'],0.00020097301299216143,esophagus; squamous epithelial cells[High],30
52,DT_score_c45,HPA,HPA:0250000,['HPA:0000000'],0.0002457826534071356,hippocampus,70
53,DT_score_c45,GO:BP,GO:0044085,['GO:0071840'],0.0003744809733907794,"""A process that results in the biosynthesis of constituent macromolecules, assembly, and arrangement of constituent parts of a cellular component. Includes biosynthesis of constituent macromolecules, and those macromolecular modifications that are involved in synthesis or assembly of the cellular component."" [GOC:jl, GOC:mah]",46
54,DT_score_c45,CORUM,CORUM:6194,['CORUM:0000000'],0.0004593194519129694,B-WICH complex,4
55,DT_score_c45,GO:BP,GO:0006405,"['GO:0050658', 'GO:0051168']",0.00046636672114173694,"""The directed movement of RNA from the nucleus to the cytoplasm."" [GOC:ma]",7
56,DT_score_c45,GO:BP,GO:0022613,['GO:0044085'],0.0005224785400630425,"""A cellular process that results in the biosynthesis of constituent macromolecules, assembly, and arrangement of constituent parts of a complex containing RNA and proteins. Includes the biosynthesis of the constituent RNA and protein molecules, and those macromolecular modifications that are involved in synthesis or assembly of the ribonucleoprotein complex."" [GOC:isa_complete, GOC:mah]",26
57,DT_score_c45,GO:CC,GO:1990904,['GO:0032991'],0.000639765354844428,"""A macromolecular complex that contains both RNA and protein molecules."" [GOC:krc, GOC:vesicles]",30
58,DT_score_c45,HPA,HPA:0461392,['HPA:0461391'],0.0006897182694567341,skin 1; cells in basal layer[≥Medium],17
59,DT_score_c45,HPA,HPA:0570813,['HPA:0570812'],0.0007108461137078771,testis; spermatogonia cells[High],27
60,DT_score_c45,GO:CC,GO:0043226,['GO:0110165'],0.0007895603846889847,"""Organized structure of distinctive morphology and function. Includes the nucleus, mitochondria, plastids, vacuoles, vesicles, ribosomes and the cytoskeleton, and prokaryotic structures such as anammoxosomes and pirellulosomes. Excludes the plasma membrane."" [GOC:go_curators]",92
61,DT_score_c45,CORUM,CORUM:6302,['CORUM:0000000'],0.0008193407099667276,B-WICH complex,4
62,DT_score_c45,GO:CC,GO:0070603,"['GO:0000785', 'GO:0140513', 'GO:1904949']",0.0011706642555745503,"""A protein complex that contains an ortholog of the Saccharomyces ATPase Swi2/Snf2 as one of the catalytic subunit components (ATPase) and mediates assembly of nucleosomes, changes to the spacing or structure of nucleosomes, or some combination of those activities in a manner that requires ATP."" [GOC:bhm, GOC:krc, GOC:mah, PMID:16155938]",6
63,DT_score_c45,HPA,HPA:0400000,['HPA:0000000'],0.0011745972051391777,rectum,75
64,DT_score_c45,GO:BP,GO:0006999,"['GO:0006997', 'GO:0043933']",0.001274768393482874,"""A process that is carried out at the cellular level which results in the assembly, arrangement of constituent parts, or disassembly of the nuclear pore."" [GOC:dph, GOC:jid, GOC:jl, GOC:mah]",4
65,DT_score_c45,HPA,HPA:0250131,['HPA:0250000'],0.0013783039503155229,hippocampus; neuronal cells[≥Low],65
66,DT_score_c45,HPA,HPA:0211091,['HPA:0210000'],0.0013843525689804942,fallopian tube; non-ciliated cells[≥Low],18
67,DT_score_c45,HPA,HPA:0330222,['HPA:0330221'],0.0014258123342305693,oral mucosa; squamous epithelial cells[≥Medium],52
68,DT_score_c45,GO:BP,GO:0050657,['GO:0015931'],0.0015321632194308064,"""The directed movement of nucleic acids, single or double-stranded polynucleotides involved in the storage, transmission and transfer of genetic information, into, out of or within a cell, or between cells, by means of some agent such as a transporter or pore."" [GOC:ai, ISBN:0198506732]",8
69,DT_score_c45,GO:BP,GO:0050658,"['GO:0050657', 'GO:0051236']",0.0015321632194308064,"""The directed movement of RNA, ribonucleic acids, into, out of or within a cell, or between cells, by means of some agent such as a transporter or pore."" [GOC:ai]",8
70,DT_score_c45,GO:CC,GO:0043227,['GO:0043226'],0.0016580505659370124,"""Organized structure of distinctive morphology and function, bounded by a single or double lipid bilayer membrane. Includes the nucleus, mitochondria, plastids, vacuoles, and vesicles. Excludes the plasma membrane."" [GOC:go_curators]",88
71,DT_score_c45,HPA,HPA:0330000,['HPA:0000000'],0.00170165385211794,oral mucosa,65
72,DT_score_c45,HPA,HPA:0330221,['HPA:0330000'],0.00170165385211794,oral mucosa; squamous epithelial cells[≥Low],65
73,DT_score_c45,GO:BP,GO:0051236,"['GO:0006403', 'GO:0051234']",0.0017671935823399755,"""The directed movement of RNA to a specific location."" [GOC:ai]",8
74,DT_score_c45,HPA,HPA:0080132,['HPA:0080131'],0.0017701161131937417,caudate; neuronal cells[≥Medium],50
75,DT_score_c45,GO:CC,GO:0000228,"['GO:0005694', 'GO:0031981']",0.0018824432739043388,"""A chromosome that encodes the nuclear genome and is found in the nucleus of a eukaryotic cell during the cell cycle phases when the nucleus is intact."" [GOC:dph, GOC:mah]",8
76,DT_score_c45,GO:BP,GO:0006360,['GO:0006351'],0.0019051952786078422,"""The synthesis of RNA from a DNA template by RNA polymerase I (RNAP I), originating at an RNAP I promoter."" [GOC:jl, GOC:txnOH]",6
77,DT_score_c45,GO:BP,GO:1901576,"['GO:0009058', 'GO:0071704']",0.00199649972064298,"""The chemical reactions and pathways resulting in the formation of an organic substance, any molecular entity containing carbon."" [GOC:pr, GOC:TermGenie]",72
78,DT_score_c45,HPA,HPA:0600222,['HPA:0600221'],0.002057129035540915,tonsil; squamous epithelial cells[≥Medium],56
79,DT_score_c45,REAC,REAC:R-HSA-4570464,['REAC:R-HSA-3108232'],0.0022284461352299694,SUMOylation of RNA binding proteins,5
80,DT_score_c45,GO:CC,GO:1902494,['GO:0032991'],0.002329924568186846,"""A protein complex which is capable of catalytic activity."" [GOC:bhm, GOC:TermGenie, PMID:8077207]",22
81,DT_score_c45,TF,TF:M09812_1,['TF:M09812'],0.002420766127552558,Factor: MYC; motif: NNCCACGTGCNN; match class: 1,49
82,DT_score_c45,TF,TF:M00217,['TF:M00000'],0.002446522943239526,Factor: USF; motif: NCACGTGN,42
83,DT_score_c45,GO:BP,GO:0051168,['GO:0006913'],0.0025498848480358946,"""The directed movement of substances out of the nucleus."" [GOC:ai]",8
84,DT_score_c45,GO:BP,GO:0009058,['GO:0008152'],0.002597545255348124,"""The chemical reactions and pathways resulting in the formation of substances; typically the energy-requiring part of metabolism in which simpler substances are transformed into more complex ones."" [GOC:curators, ISBN:0198547684]",72
85,DT_score_c45,GO:CC,GO:0043231,"['GO:0043227', 'GO:0043229']",0.002689032510449971,"""Organized structure of distinctive morphology and function, bounded by a single or double lipid bilayer membrane and occurring within the cell. Includes the nucleus, mitochondria, plastids, vacuoles, and vesicles. Excludes the plasma membrane."" [GOC:go_curators]",84
86,DT_score_c45,KEGG,KEGG:03013,['KEGG:00000'],0.0033541620236672647,Nucleocytoplasmic transport,6
87,DT_score_c45,GO:CC,GO:0098687,"['GO:0005694', 'GO:0110165']",0.0034024268931235023,"""Any subdivision of a chromosome along its length."" [GOC:dos]",10
88,DT_score_c45,HPA,HPA:0190221,['HPA:0190000'],0.003455078619696224,esophagus; squamous epithelial cells[≥Low],67
89,DT_score_c45,HPA,HPA:0190000,['HPA:0000000'],0.003455078619696224,esophagus,67
90,DT_score_c45,GO:BP,GO:0045945,"['GO:0006359', 'GO:0006383', 'GO:0045893']",0.0035694340622202457,"""Any process that activates or increases the frequency, rate or extent of transcription mediated by RNA polymerase III."" [GOC:go_curators, GOC:txnOH]",4
91,DT_score_c45,HPA,HPA:0461391,['HPA:0460000'],0.0036438006684528647,skin 1; cells in basal layer[≥Low],19
92,DT_score_c45,HPA,HPA:0320000,['HPA:0000000'],0.0037079727027137846,nasopharynx,70
93,DT_score_c45,HPA,HPA:0470671,['HPA:0470000'],0.003782576737259079,skin 2; melanocytes[≥Low],17
94,DT_score_c45,HPA,HPA:0630221,['HPA:0630000'],0.003786206464255447,cervix; squamous epithelial cells[≥Low],59
95,DT_score_c45,GO:BP,GO:1901360,['GO:0071704'],0.003854387506424275,"""The chemical reactions and pathways involving organic cyclic compound."" [GOC:TermGenie]",62
96,DT_score_c45,HPA,HPA:0090000,['HPA:0000000'],0.003867843544963529,cerebellum,70
97,DT_score_c45,REAC,REAC:R-HSA-2990846,['REAC:R-HSA-597592'],0.0039309085007937054,SUMOylation,8
98,DT_score_c45,GO:CC,GO:0099080,['GO:0110165'],0.003962890711990405,"""A cellular component that consists of an indeterminate number of proteins or macromolecular complexes, organized into a regular, higher-order structure such as a polymer, sheet, network or a fiber."" [GOC:dos]",19
99,DT_score_c45,GO:BP,GO:0044249,"['GO:0009058', 'GO:0044237']",0.004048842147994069,"""The chemical reactions and pathways resulting in the formation of substances, carried out by individual cells."" [GOC:jl]",71
100,DT_score_c45,TF,TF:M00799,['TF:M00000'],0.004152980642045391,Factor: Myc; motif: CACGTGS,47
101,DT_score_c45,GO:MF,GO:0017056,['GO:0005198'],0.004168186825937169,"""The action of a molecule that contributes to the structural integrity of the nuclear pore complex, a protein-lined channel in the nuclear envelope that allows the transfer of macromolecules."" [GOC:mah, PMID:25802992]",4
102,DT_score_c45,TF,TF:M04743,['TF:M00000'],0.004288845319835112,Factor: c-Myc; motif: NSCACGTGGN,46
103,DT_score_c45,HPA,HPA:0100131,['HPA:0100000'],0.004349151341091776,cerebral cortex; neuronal cells[≥Low],67
104,DT_score_c45,GO:BP,GO:0009059,"['GO:0043170', 'GO:0044249', 'GO:1901576']",0.005122965738804048,"""The chemical reactions and pathways resulting in the formation of a macromolecule, any molecule of high relative molecular mass, the structure of which essentially comprises the multiple repetition of units derived, actually or conceptually, from molecules of low relative molecular mass."" [GOC:mah]",67
105,DT_score_c45,KEGG,KEGG:03040,['KEGG:00000'],0.005863020695241411,Spliceosome,7
106,DT_score_c45,HPA,HPA:0471392,['HPA:0471391'],0.0063916591828634016,skin 2; cells in basal layer[≥Medium],17
107,DT_score_c45,HPA,HPA:0600431,['HPA:0600000'],0.0066766412403259255,tonsil; germinal center cells[≥Low],62
108,DT_score_c45,GO:CC,GO:0043229,"['GO:0005622', 'GO:0043226']",0.006755750185771349,"""Organized structure of distinctive morphology and function, occurring within the cell. Includes the nucleus, mitochondria, plastids, vacuoles, vesicles, ribosomes and the cytoskeleton. Excludes the plasma membrane."" [GOC:go_curators]",88
109,DT_score_c45,HPA,HPA:0570811,['HPA:0570000'],0.006873274192969157,testis; spermatogonia cells[≥Low],40
110,DT_score_c45,GO:BP,GO:0046483,['GO:0044237'],0.007040056352970587,"""The chemical reactions and pathways involving heterocyclic compounds, those with a cyclic molecular structure and at least two different atoms in the ring (or rings)."" [ISBN:0198506732]",60
111,DT_score_c45,HPA,HPA:0461411,['HPA:0460000'],0.007074538847605218,skin 1; cells in spinous layer[≥Low],17
112,DT_score_c45,GO:BP,GO:0051169,['GO:0046907'],0.007154819530269356,"""The directed movement of substances into, out of, or within the nucleus."" [GOC:ai]",10
113,DT_score_c45,GO:BP,GO:0006913,['GO:0051169'],0.007154819530269356,"""The directed movement of molecules between the nucleus and the cytoplasm."" [GOC:go_curators]",10
114,DT_score_c45,HPA,HPA:0080131,['HPA:0080000'],0.007817632565247232,caudate; neuronal cells[≥Low],63
115,DT_score_c45,HPA,HPA:0060842,['HPA:0060841'],0.008092078879506017,bronchus; basal cells[≥Medium],13
116,DT_score_c45,GO:BP,GO:0006139,"['GO:0006725', 'GO:0034641', 'GO:0044238', 'GO:0046483', 'GO:1901360']",0.008381577640563584,"""Any cellular metabolic process involving nucleobases, nucleosides, nucleotides and nucleic acids."" [GOC:ai]",59
117,DT_score_c45,HPA,HPA:0050051,['HPA:0050000'],0.008668618640071853,breast; glandular cells[≥Low],67
118,DT_score_c45,GO:BP,GO:0006725,['GO:0044237'],0.008936732793212944,"""The chemical reactions and pathways involving aromatic compounds, any organic compound characterized by one or more planar rings, each of which contains conjugated double bonds and delocalized pi electrons, as carried out by individual cells."" [GOC:ai, ISBN:0198506732]",60
119,DT_score_c45,REAC,REAC:R-HSA-170822,['REAC:R-HSA-70171'],0.0090087561566627,Regulation of Glucokinase by Glucokinase Regulatory Protein,4
120,DT_score_c45,REAC,REAC:R-HSA-5619107,['REAC:R-HSA-5619102'],0.0090087561566627,Defective TPR may confer susceptibility towards thyroid papillary carcinoma (TPC),4
121,DT_score_c45,TF,TF:M01154,['TF:M00000'],0.009167260742546248,Factor: c-Myc; motif: KACCACGTGSYY,48
122,DT_score_c45,GO:BP,GO:0030490,"['GO:0006364', 'GO:0042274']",0.009315544446240387,"""Any process involved in the maturation of a precursor Small SubUnit (SSU) ribosomal RNA (rRNA) molecule into a mature SSU-rRNA molecule."" [GOC:curators]",5
123,DT_score_c45,REAC,REAC:R-HSA-168333,['REAC:R-HSA-168274'],0.010403232762596781,NEP/NS2 Interacts with the Cellular Export Machinery,4
124,DT_score_c45,REAC,REAC:R-HSA-168271,['REAC:R-HSA-168255'],0.010403232762596781,Transport of Ribonucleoproteins into the Host Nucleus,4
125,DT_score_c45,TF,TF:M00055,['TF:M00000'],0.01041475414080091,Factor: N-Myc; motif: NNCCACGTGNNN,41
126,DT_score_c45,GO:CC,GO:0000793,['GO:0005694'],0.010554781141434046,"""A highly compacted molecule of DNA and associated proteins resulting in a cytologically distinct structure."" [GOC:elh]",8
