,method,source,native,parents,p_value,description,intersection_size
293,multi_Lasso,GO:BP,GO:0044060,"['GO:0044057', 'GO:0050886']",0.002739321367089525,"""Any process that modulates the frequency, rate or extent of an endocrine process, a process involving the secretion of or response to endocrine hormones. An endocrine hormone is a hormone released into the circulatory system."" [GOC:jl]",5
294,multi_Lasso,GO:CC,GO:0005783,"['GO:0005737', 'GO:0012505', 'GO:0043231']",0.002860726969646463,"""The irregular network of unit membranes, visible only by electron microscopy, that occurs in the cytoplasm of many eukaryotic cells. The membranes form a complex meshwork of tubular channels, which are often expanded into slitlike cavities called cisternae. The ER takes two forms, rough (or granular), with ribosomes adhering to the outer surface, and smooth (with no ribosomes attached)."" [ISBN:0198506732]",24
295,multi_Lasso,GO:BP,GO:0050818,"['GO:0050817', 'GO:0051239']",0.003035152210939913,"""Any process that modulates the frequency, rate or extent of coagulation, the process in which a fluid solution, or part of it, changes into a solid or semisolid mass."" [GOC:ai]",6
296,multi_Lasso,GO:BP,GO:0035136,['GO:0035108'],0.003108187358879307,"""The process in which the anatomical structures of the forelimb are generated and organized. The forelimbs are the front limbs of an animal, e.g. the arms of a human."" [GOC:go_curators]",5
297,multi_Lasso,GO:MF,GO:0043178,['GO:0036094'],0.003146072105459792,"""Binding to an alcohol, any of a class of alkyl compounds containing a hydroxyl group."" [GOC:jl, ISBN:0198506732]",6
298,multi_Lasso,HPA,HPA:0640201,['HPA:0640000'],0.0031660472211213447,endometrium; endothelial cells[≥Low],5
299,multi_Lasso,GO:BP,GO:0040012,"['GO:0040011', 'GO:0050789']",0.0033652841572356434,"""Any process that modulates the frequency, rate or extent of locomotion of a cell or organism."" [GOC:ems]",18
300,multi_Lasso,GO:BP,GO:0007155,['GO:0009987'],0.003636655220365542,"""The attachment of a cell, either to another cell or to an underlying substrate such as the extracellular matrix, via cell adhesion molecules."" [GOC:hb, GOC:pf]",22
301,multi_Lasso,GO:BP,GO:0007160,['GO:0031589'],0.0038293175841413027,"""The binding of a cell to the extracellular matrix via adhesion molecules."" [GOC:hb]",9
302,multi_Lasso,GO:BP,GO:0010647,"['GO:0007154', 'GO:0010646', 'GO:0048522']",0.004109375417539765,"""Any process that increases the frequency, rate or extent of cell communication. Cell communication is the process that mediates interactions between a cell and its surroundings. Encompasses interactions such as signaling or attachment between one cell and another cell, between a cell and an extracellular matrix, or between a cell and any other aspect of its environment."" [GOC:dph, GOC:tb]",24
303,multi_Lasso,GO:BP,GO:0023056,"['GO:0023051', 'GO:0023052', 'GO:0048518']",0.004150307375698317,"""Any process that activates, maintains or increases the frequency, rate or extent of a signaling process."" [GOC:mtg_signal]",24
304,multi_Lasso,GO:BP,GO:0048856,['GO:0032502'],0.004198495329667033,"""The biological process whose specific outcome is the progression of an anatomical structure from an initial condition to its mature state. This process begins with the formation of the structure and ends with the mature structure, whatever form that may be including its natural destruction. An anatomical structure is any biological entity that occupies space and is distinguished from its surroundings. Anatomical structures can be macroscopic such as a carpel, or microscopic such as an acrosome."" [GO_REF:0000021]",50
305,multi_Lasso,GO:BP,GO:0030326,"['GO:0035108', 'GO:0035113']",0.00475905642358842,"""The process, occurring in the embryo, by which the anatomical structures of the limb are generated and organized. A limb is an appendage of an animal used for locomotion or grasping."" [GOC:bf, GOC:jl, ISBN:0395825172]",7
306,multi_Lasso,GO:BP,GO:0035113,"['GO:0035107', 'GO:0048598']",0.00475905642358842,"""The process, occurring in the embryo, by which the anatomical structures of the appendage are generated and organized. An appendage is an organ or part that is attached to the trunk of an organism, such as a limb or a branch."" [ISBN:0582227089]",7
307,multi_Lasso,GO:BP,GO:0061298,"['GO:0001944', 'GO:0060041']",0.004800537292633559,"""The process whose specific outcome is the progression of the vasculature of the retina over time, from its formation to the mature structure."" [GOC:BHF, GOC:dph]",4
308,multi_Lasso,HPA,HPA:0640693,['HPA:0640692'],0.005408256730685123,endometrium; smooth muscle cells[High],4
309,multi_Lasso,GO:CC,GO:0070288,['GO:0032991'],0.005985166130924771,"""A protein complex that binds iron and acts as a major iron storage system. Intracellular and extracellular ferritin complexes have different ratios of two types of ferritin monomer, the L (light) chain and H (heavy) chain."" [GOC:mah, PMID:19154717]",2
310,multi_Lasso,GO:CC,GO:0008043,"['GO:0070288', 'GO:0140535']",0.005985166130924771,"""A ferritin complex located in the cell. Intracellular ferritin complexes contain 24 subunits, in a mixture of L (light) chains and H (heavy) chains."" [GOC:jl, GOC:mah, PMID:19154717]",2
311,multi_Lasso,GO:BP,GO:0008202,"['GO:0006629', 'GO:1901360']",0.007099341698592293,"""The chemical reactions and pathways involving steroids, compounds with a 1,2,cyclopentanoperhydrophenanthrene nucleus."" [ISBN:0198547684]",10
312,multi_Lasso,GO:CC,GO:0034362,['GO:0034358'],0.007273705386578731,"""A lipoprotein particle, rich in cholesterol esters and low in triglycerides that is typically composed of APOB100 and APOE and has a density of 1.02-1.06 g/ml and a diameter of between 20-25 nm. LDL particles are formed from VLDL particles (via IDL) by the loss of triglyceride and gain of cholesterol ester. They transport endogenous cholesterol (and to some extent triglycerides) from peripheral tissues back to the liver."" [GOC:BHF, GOC:expert_pt, GOC:mah, GOC:rl]",3
313,multi_Lasso,GO:BP,GO:0023051,"['GO:0023052', 'GO:0050789']",0.0074049565550853265,"""Any process that modulates the frequency, rate or extent of a signaling process."" [GOC:mtg_signal]",35
314,multi_Lasso,GO:BP,GO:0030195,"['GO:0007596', 'GO:0030193', 'GO:0050819', 'GO:0061045', 'GO:1900047']",0.007676898705508709,"""Any process that stops, prevents, or reduces the frequency, rate or extent of blood coagulation."" [GOC:mah]",5
315,multi_Lasso,GO:BP,GO:0010646,"['GO:0007154', 'GO:0050794']",0.007711214015600894,"""Any process that modulates the frequency, rate or extent of cell communication. Cell communication is the process that mediates interactions between a cell and its surroundings. Encompasses interactions such as signaling or attachment between one cell and another cell, between a cell and an extracellular matrix, or between a cell and any other aspect of its environment."" [GOC:dph, GOC:tb]",35
316,multi_Lasso,GO:BP,GO:1900047,"['GO:0007599', 'GO:0048519', 'GO:1900046']",0.008498204415195023,"""Any process that stops, prevents or reduces the frequency, rate or extent of hemostasis."" [GOC:TermGenie]",5
317,multi_Lasso,GO:BP,GO:0065008,['GO:0065007'],0.008710892405802317,"""Any process that modulates a qualitative or quantitative trait of a biological quality. A biological quality is a measurable attribute of an organism or part of an organism, such as size, mass, shape, color, etc."" [GOC:dph, GOC:isa_complete, GOC:mah, GOC:pr, GOC:vw]",31
318,multi_Lasso,GO:BP,GO:0042221,['GO:0050896'],0.009482237012620827,"""Any process that results in a change in state or activity of a cell or an organism (in terms of movement, secretion, enzyme production, gene expression, etc.) as a result of a chemical stimulus."" [GOC:jl]",38
319,multi_Lasso,GO:BP,GO:0040011,['GO:0008150'],0.009490072121417678,"""Self-propelled movement of a cell or organism from one location to another."" [GOC:dgh]",19
320,multi_Lasso,GO:BP,GO:0040013,"['GO:0040011', 'GO:0040012', 'GO:0048519']",0.009534905042919295,"""Any process that stops, prevents, or reduces the frequency, rate or extent of locomotion of a cell or organism."" [GOC:go_curators]",10
321,multi_Lasso,GO:BP,GO:0048519,"['GO:0008150', 'GO:0050789']",0.009729169932076485,"""Any process that stops, prevents, or reduces the frequency, rate or extent of a biological process. Biological processes are regulated by many means; examples include the control of gene expression, protein modification or interaction with a protein or substrate molecule."" [GOC:jid]",49
322,multi_Lasso,GO:BP,GO:0009790,['GO:0007275'],0.010817514855085976,"""The process whose specific outcome is the progression of an embryo from its formation until the end of its embryonic life stage. The end of the embryonic stage is organism-specific. For example, for mammals, the process would begin with zygote formation and end with birth. For insects, the process would begin at zygote formation and end with larval hatching. For plant zygotic embryos, this would be from zygote formation to the end of seed dormancy. For plant vegetative embryos, this would be from the initial determination of the cell or group of cells to form an embryo until the point when the embryo becomes independent of the parent plant."" [GOC:go_curators, GOC:isa_complete, GOC:mtg_sensu]",18
323,multi_Lasso,GO:CC,GO:0030054,['GO:0110165'],0.011072567710660567,"""A cellular component that forms a specialized region of connection between two or more cells, or between a cell and the extracellular matrix, or between two membrane-bound components of a cell, such as flagella."" [GOC:aruk, GOC:bc, GOC:mah, http://www.vivo.colostate.edu/hbooks/cmb/cells/pmemb/junctions_a.html, ISBN:0198506732, PMID:26820516, PMID:28096264]",24
324,multi_Lasso,GO:BP,GO:0048523,"['GO:0009987', 'GO:0048519', 'GO:0050794']",0.011453510224049522,"""Any process that stops, prevents, or reduces the frequency, rate or extent of a cellular process, any of those that are carried out at the cellular level, but are not necessarily restricted to a single cell. For example, cell communication occurs among more than one cell, but occurs at the cellular level."" [GOC:jid]",47
325,multi_Lasso,GO:BP,GO:0008285,"['GO:0008283', 'GO:0042127', 'GO:0048523']",0.011565694734066979,"""Any process that stops, prevents or reduces the rate or extent of cell proliferation."" [GOC:go_curators]",14
326,multi_Lasso,GO:MF,GO:0004866,"['GO:0030414', 'GO:0061135']",0.011841428205763041,"""Binds to and stops, prevents or reduces the activity of an endopeptidase."" [GOC:jl]",7
327,multi_Lasso,HPA,HPA:0640203,['HPA:0640202'],0.012252825594438055,endometrium; endothelial cells[High],4
328,multi_Lasso,GO:MF,GO:0048407,['GO:0019838'],0.012280773188451832,"""Binding to platelet-derived growth factor."" [GOC:dgh]",3
329,multi_Lasso,GO:BP,GO:1903035,"['GO:0009611', 'GO:0048585', 'GO:1903034']",0.012367154195266366,"""Any process that stops, prevents or reduces the frequency, rate or extent of response to wounding."" [GO_REF:0000058, GOC:kmv, GOC:TermGenie, PMID:19164535]",6
330,multi_Lasso,GO:BP,GO:0061438,"['GO:0009653', 'GO:0061437']",0.012659177783177811,"""The process in which the renal system vasculature is generated and organized. Morphogenesis pertains to the creation of form."" [GOC:dph, GOC:mtg_kidney_jan10, PMID:11891195]",3
331,multi_Lasso,GO:BP,GO:0061439,"['GO:0009653', 'GO:0061438', 'GO:0061440']",0.012659177783177811,"""The process in which the kidney vasculature is generated and organized. Morphogenesis pertains to the creation of form."" [GOC:dph, GOC:mtg_kidney_jan10]",3
332,multi_Lasso,GO:BP,GO:0007423,['GO:0048513'],0.012945726651723152,"""The process whose specific outcome is the progression of sensory organs over time, from its formation to the mature structure."" [GOC:go_curators]",13
333,multi_Lasso,GO:BP,GO:0051240,"['GO:0032501', 'GO:0048518', 'GO:0051239']",0.013263416108812282,"""Any process that activates or increases the frequency, rate or extent of an organismal process, any of the processes pertinent to the function of an organism above the cellular level; includes the integrated processes of tissues and organs."" [GOC:ai]",22
334,multi_Lasso,GO:BP,GO:0043010,['GO:0001654'],0.013660566376998997,"""The process whose specific outcome is the progression of the camera-type eye over time, from its formation to the mature structure. The camera-type eye is an organ of sight that receives light through an aperture and focuses it through a lens, projecting it on a photoreceptor field."" [GOC:go_curators, GOC:mtg_sensu]",10
335,multi_Lasso,GO:BP,GO:0007044,"['GO:0034329', 'GO:0150115']",0.013974768237660846,"""The aggregation, arrangement and bonding together of a set of components to form a junction between a cell and its substrate."" [GOC:mah]",6
336,multi_Lasso,GO:CC,GO:0045121,['GO:0098857'],0.014315711140000943,"""Any of the small (10-200 nm), heterogeneous, highly dynamic, sterol- and sphingolipid-enriched membrane domains that compartmentalize cellular processes. Small rafts can sometimes be stabilized to form larger platforms through protein-protein and protein-lipid interactions."" [PMID:16645198, PMID:20044567]",8
337,multi_Lasso,GO:MF,GO:0005543,['GO:0008289'],0.014461849529680824,"""Binding to a phospholipid, a class of lipids containing phosphoric acid as a mono- or diester."" [ISBN:0198506732]",11
338,multi_Lasso,GO:BP,GO:0051894,"['GO:0001954', 'GO:0048041', 'GO:0051893', 'GO:0150117', 'GO:1901890']",0.014495114263790949,"""Any process that activates or increases the frequency, rate or extent of focal adhesion assembly, the establishment and maturation of focal adhesions."" [GOC:ai]",4
339,multi_Lasso,GO:CC,GO:0098857,['GO:0016020'],0.014668076813274446,"""A membrane region with a lipid composition that is distinct from that of the membrane regions that surround it."" [PMID:20044567, PMID:26253820]",8
340,multi_Lasso,GO:MF,GO:0030414,"['GO:0004857', 'GO:0061134']",0.014854786907898222,"""Binds to and stops, prevents or reduces the activity of a peptidase, any enzyme that catalyzes the hydrolysis peptide bonds."" [GOC:jl]",7
341,multi_Lasso,REAC,REAC:R-HSA-196025,['REAC:R-HSA-190873'],0.014928572419202297,Formation of annular gap junctions,3
342,multi_Lasso,GO:BP,GO:0001954,"['GO:0001952', 'GO:0007160', 'GO:0010811']",0.01498281782694339,"""Any process that activates or increases the rate or extent of cell adhesion to an extracellular matrix."" [GOC:hjd]",5
343,multi_Lasso,GO:BP,GO:0051129,"['GO:0016043', 'GO:0048523', 'GO:0051128']",0.015441376237137842,"""Any process that stops, prevents, or reduces the frequency, rate or extent of a process involved in the formation, arrangement of constituent parts, or disassembly of cell structures, including the plasma membrane and any external encapsulating structures such as the cell wall and cell envelope."" [GOC:ai]",14
344,multi_Lasso,CORUM,CORUM:6135,['CORUM:0000000'],0.01668595271458441,Ferritin complex,2
345,multi_Lasso,GO:BP,GO:0010033,['GO:0042221'],0.016782590224764735,"""Any process that results in a change in state or activity of a cell or an organism (in terms of movement, secretion, enzyme production, gene expression, etc.) as a result of an organic substance stimulus."" [GOC:sm, PMID:23356676]",29
346,multi_Lasso,REAC,REAC:R-HSA-8963899,['REAC:R-HSA-174824'],0.01722589164075345,Plasma lipoprotein remodeling,4
347,multi_Lasso,GO:BP,GO:2000026,"['GO:0007275', 'GO:0050793', 'GO:0051239']",0.01757706478968369,"""Any process that modulates the frequency, rate or extent of multicellular organismal development."" [GOC:obol]",20
348,multi_Lasso,GO:BP,GO:0035108,"['GO:0035107', 'GO:0060173']",0.01816624609903156,"""The process in which the anatomical structures of a limb are generated and organized. A limb is a paired appendage of a tetrapod used for locomotion or grasping."" [UBERON:0002101]",7
349,multi_Lasso,GO:BP,GO:0035107,"['GO:0009653', 'GO:0048736']",0.01816624609903156,"""The process in which the anatomical structures of appendages are generated and organized. An appendage is an organ or part that is attached to the trunk of an organism, such as a limb or a branch."" [ISBN:0582227089]",7
350,multi_Lasso,GO:BP,GO:0001501,['GO:0048731'],0.018278543557379415,"""The process whose specific outcome is the progression of the skeleton over time, from its formation to the mature structure. The skeleton is the bony framework of the body in vertebrates (endoskeleton) or the hard outer envelope of insects (exoskeleton or dermoskeleton)."" [GOC:dph, GOC:jid, GOC:tb]",12
351,multi_Lasso,GO:BP,GO:0010810,"['GO:0030155', 'GO:0031589']",0.01835512597210896,"""Any process that modulates the frequency, rate or extent of cell-substrate adhesion. Cell-substrate adhesion is the attachment of a cell to the underlying substrate via adhesion molecules."" [GOC:dph, GOC:pf, GOC:tb]",8
352,multi_Lasso,GO:BP,GO:0030336,"['GO:0016477', 'GO:0030334', 'GO:2000146']",0.01841666896922819,"""Any process that stops, prevents, or reduces the frequency, rate or extent of cell migration."" [GOC:go_curators]",9
353,multi_Lasso,GO:BP,GO:0072239,"['GO:0072012', 'GO:0072224']",0.01892381126968203,"""The biological process whose specific outcome is the progression of a metanephric glomerulus vasculature from an initial condition to its mature state. This process begins with the formation of the metanephric glomerulus vasculature and ends with the mature structure. The metanephric glomerulus vasculature is composed of the tubule structures that carry blood or lymph in the metanephric glomerulus."" [GOC:mtg_kidney_jan10]",3
354,multi_Lasso,GO:BP,GO:0030325,"['GO:0035270', 'GO:0048732']",0.019709121391422075,"""The process whose specific outcome is the progression of the adrenal gland over time, from its formation to the mature structure. This gland can either be a discrete structure located bilaterally above each kidney, or a cluster of cells in the head kidney that perform the functions of the adrenal gland. In either case, this organ consists of two cells types, aminergic chromaffin cells and steroidogenic cortical cells."" [GOC:dgh]",4
355,multi_Lasso,REAC,REAC:R-HSA-190873,['REAC:R-HSA-190828'],0.019818145600649123,Gap junction degradation,3
356,multi_Lasso,GO:MF,GO:0015248,['GO:0005319'],0.02082247681802619,"""Enables the directed movement of sterols into, out of or within a cell, or between cells. Sterol are steroids with one or more hydroxyl groups and a hydrocarbon side-chain in the molecule."" [GOC:ai]",4
357,multi_Lasso,GO:BP,GO:0051050,"['GO:0006810', 'GO:0048518', 'GO:0051049']",0.021006461442162446,"""Any process that activates or increases the frequency, rate or extent of the directed movement of substances (such as macromolecules, small molecules, ions) into, out of or within a cell, or between cells, by means of some agent such as a transporter or pore."" [GOC:ai]",15
358,multi_Lasso,GO:MF,GO:0061135,['GO:0061134'],0.021270257266941026,"""Binds to and modulates the activity of a peptidase, any enzyme that hydrolyzes nonterminal peptide bonds in polypeptides."" [GOC:dph, GOC:tb]",7
359,multi_Lasso,GO:BP,GO:0048732,['GO:0048513'],0.02184077264536613,"""The process whose specific outcome is the progression of a gland over time, from its formation to the mature structure. A gland is an organ specialised for secretion."" [GOC:jid]",11
360,multi_Lasso,GO:BP,GO:0072006,"['GO:0001822', 'GO:0048856']",0.02242141191540101,"""The process whose specific outcome is the progression of the nephron over time, from its formation to the mature structure. A nephron is the functional unit of the kidney."" [GOC:mtg_kidney_jan10]",7
361,multi_Lasso,GO:BP,GO:0006066,"['GO:0044281', 'GO:1901615']",0.022723970435179947,"""The chemical reactions and pathways involving alcohols, any of a class of compounds containing one or more hydroxyl groups attached to a saturated carbon atom."" [ISBN:0198506732]",10
362,multi_Lasso,GO:BP,GO:0042733,"['GO:0030326', 'GO:0048598']",0.022905000517019537,"""The process, occurring in the embryo, by which the anatomical structures of the digit are generated and organized. A digit is one of the terminal divisions of an appendage, such as a finger or toe."" [GOC:bf, GOC:jl, UBERON:0002544]",5
363,multi_Lasso,KEGG,KEGG:04979,['KEGG:00000'],0.023291851720296373,Cholesterol metabolism,4
364,multi_Lasso,REAC,REAC:R-HSA-166658,['REAC:R-HSA-168249'],0.024107721196011594,Complement cascade,6
365,multi_Lasso,GO:CC,GO:0099503,['GO:0031410'],0.024146398826615696,"""A cytoplasmic, membrane bound vesicle that is capable of fusing to the plasma membrane to release its contents into the extracellular space."" [GOC:dos]",15
366,multi_Lasso,GO:BP,GO:0001935,['GO:0050673'],0.024340212861366322,"""The multiplication or reproduction of endothelial cells, resulting in the expansion of a cell population. Endothelial cells are thin flattened cells which line the inside surfaces of body cavities, blood vessels, and lymph vessels, making up the endothelium."" [GOC:add, ISBN:0781735149]",7
367,multi_Lasso,GO:BP,GO:0007267,"['GO:0007154', 'GO:0023052']",0.025099332321492807,"""Any process that mediates the transfer of information from one cell to another. This process includes signal transduction in the receiving cell and, where applicable, release of a ligand and any processes that actively facilitate its transport and presentation to the receiving cell. Examples include signaling via soluble ligands, via cell adhesion molecules and via gap junctions."" [GOC:dos, GOC:mah]",22
368,multi_Lasso,GO:BP,GO:0048568,"['GO:0009790', 'GO:0048513']",0.02624027289589614,"""Development, taking place during the embryonic phase, of a tissue or tissues that work together to perform a specific function or functions. Development pertains to the process whose specific outcome is the progression of a structure over time, from its formation to the mature structure. Organs are commonly observed as visibly distinct structures, but may also exist as loosely associated clusters of cells that work together to perform a specific function or functions."" [GOC:jid]",11
369,multi_Lasso,GO:MF,GO:0005161,['GO:0070851'],0.026810075106193834,"""Binding to a platelet-derived growth factor receptor."" [GOC:ai]",3
370,multi_Lasso,GO:BP,GO:0032502,['GO:0008150'],0.02718630201429226,"""A biological process whose specific outcome is the progression of an integrated living unit: an anatomical structure (which may be a subcellular structure, cell, tissue, or organ), or organism over time from an initial condition to a later condition."" [GOC:isa_complete]",51
371,multi_Lasso,GO:BP,GO:0009611,['GO:0006950'],0.027364669885332902,"""Any process that results in a change in state or activity of a cell or an organism (in terms of movement, secretion, enzyme production, gene expression, etc.) as a result of a stimulus indicating damage to the organism."" [GOC:go_curators]",12
372,multi_Lasso,GO:BP,GO:2000146,"['GO:0040013', 'GO:0048523', 'GO:0048870', 'GO:2000145']",0.028500661399108576,"""Any process that stops, prevents, or reduces the frequency, rate or extent of cell motility."" [GOC:mah]",9
373,multi_Lasso,GO:CC,GO:0034774,"['GO:0030141', 'GO:0060205']",0.029156735522555696,"""The volume enclosed by the membrane of a secretory granule."" [GOC:rph]",8
374,multi_Lasso,GO:MF,GO:0042803,"['GO:0042802', 'GO:0046983']",0.029919412576589064,"""Binding to an identical protein to form a homodimer."" [GOC:jl]",13
375,multi_Lasso,GO:BP,GO:0150117,"['GO:0051130', 'GO:0150115', 'GO:0150116']",0.029961724300298337,"""Any process that activates or increases the frequency, rate or extent of cell-substrate junction organization."" [GOC:aruk]",4
376,multi_Lasso,GO:BP,GO:0061440,"['GO:0001822', 'GO:0061437']",0.029961724300298337,"""The process whose specific outcome is the progression of the vasculature of the kidney over time, from its formation to the mature structure."" [GOC:dph, GOC:mtg_kidney_jan10, PMID:11891195]",4
377,multi_Lasso,GO:BP,GO:0061437,"['GO:0001944', 'GO:0072001']",0.029961724300298337,"""The process whose specific outcome is the progression of vasculature of the renal system over time, from its formation to the mature structure."" [GOC:dph, GOC:mtg_kidney_jan10, PMID:11891195]",4
378,multi_Lasso,GO:CC,GO:0060205,"['GO:0031410', 'GO:0031983', 'GO:0070013']",0.031099572142958165,"""The volume enclosed by a cytoplasmic vesicle."" [GOC:dph, GOC:vesicles]",8
379,multi_Lasso,GO:BP,GO:0048562,"['GO:0009887', 'GO:0048568', 'GO:0048598']",0.031655081875152404,"""Morphogenesis, during the embryonic phase, of a tissue or tissues that work together to perform a specific function or functions. Morphogenesis is the process in which anatomical structures are generated and organized. Organs are commonly observed as visibly distinct structures, but may also exist as loosely associated clusters of cells that work together to perform a specific function or functions."" [GOC:jid]",9
380,multi_Lasso,GO:CC,GO:0031983,"['GO:0031982', 'GO:0043233']",0.03177054078158607,"""The volume enclosed by the membrane or protein that forms a vesicle."" [GOC:mah, GOC:vesicles]",8
381,multi_Lasso,GO:BP,GO:0030301,['GO:0015918'],0.032249171731256,"""The directed movement of cholesterol, cholest-5-en-3-beta-ol, into, out of or within a cell, or between cells, by means of some agent such as a transporter or pore."" [GOC:mah, ISBN:0198506732]",6
382,multi_Lasso,GO:CC,GO:0034361,['GO:0034385'],0.03295555682267154,"""A triglyceride-rich lipoprotein particle that is typically composed of APOB100, APOE and APOCs and has a density of about 1.006 g/ml and a diameter of between 20-80 nm. It is found in blood and transports endogenous products (newly synthesized cholesterol and triglycerides) from the liver."" [GOC:BHF, GOC:expert_pt, GOC:mah, GOC:rl]",3
