,method,source,native,parents,p_value,description,intersection_size
0,DT_score_c45,GO:CC,GO:0005576,['GO:0110165'],2.236397259989545e-11,"""The space external to the outermost structure of a cell. For cells without external protective or external encapsulating structures this refers to space outside of the plasma membrane. This term covers the host cell environment outside an intracellular parasite."" [GOC:go_curators]",50
1,DT_score_c45,GO:CC,GO:0005615,"['GO:0005576', 'GO:0110165']",1.903943041597857e-10,"""That part of a multicellular organism outside the cells proper, usually taken to be outside the plasma membranes, and occupied by fluid."" [ISBN:0198547684]",43
2,DT_score_c45,GO:CC,GO:0070062,"['GO:0005615', 'GO:1903561']",1.4465272924766413e-06,"""A vesicle that is released into the extracellular region by fusion of the limiting endosomal membrane of a multivesicular body with the plasma membrane. Extracellular exosomes, also simply called exosomes, have a diameter of about 40-100 nm."" [GOC:BHF, GOC:mah, GOC:vesicles, PMID:15908444, PMID:17641064, PMID:19442504, PMID:19498381, PMID:22418571, PMID:24009894]",29
3,DT_score_c45,GO:CC,GO:1903561,"['GO:0031982', 'GO:0065010']",1.8701715294574823e-06,"""Any vesicle that is part of the extracellular region."" [GO_REF:0000064, GOC:pm, GOC:TermGenie, PMID:24769233]",29
4,DT_score_c45,GO:CC,GO:0065010,"['GO:0043227', 'GO:0043230']",1.8901381484731696e-06,"""Organized structure of distinctive morphology and function, bounded by a lipid bilayer membrane and occurring outside the cell."" [GOC:isa_complete]",29
5,DT_score_c45,GO:CC,GO:0043230,"['GO:0005576', 'GO:0043226']",1.8901381484731696e-06,"""Organized structure of distinctive morphology and function, occurring outside the cell. Includes, for example, extracellular membrane vesicles (EMVs) and the cellulosomes of anaerobic bacteria and fungi."" [GOC:jl, PMID:9914479]",29
6,DT_score_c45,GO:CC,GO:0031982,['GO:0043227'],2.2262428570179583e-05,"""Any small, fluid-filled, spherical organelle enclosed by membrane."" [GOC:mah, GOC:pz, GOC:vesicles]",39
7,DT_score_c45,REAC,REAC:R-HSA-6809371,['REAC:R-HSA-6805567'],4.363366635263578e-05,Formation of the cornified envelope,9
8,DT_score_c45,GO:CC,GO:0001533,['GO:0005886'],5.106741374139248e-05,"""A type of plasma membrane that has been modified through addition of distinct intracellular and extracellular components, including ceramide, found in cornifying epithelial cells (corneocytes)."" [GOC:add, PMID:11112355, PMID:11590230, PMID:15803139]",6
9,DT_score_c45,HP,HP:0001818,['HP:0100803'],5.7747759931815535e-05,The nail disease paronychia is an often-tender bacterial or fungal hand infection or foot infection where the nail and skin meet at the side or the base of a finger or toenail. The infection can start suddenly (acute paronychia) or gradually (chronic paronychia).,5
10,DT_score_c45,GO:BP,GO:0045109,"['GO:0045104', 'GO:0097435']",6.104707004421632e-05,"""Control of the spatial distribution of intermediate filaments; includes organizing filaments into meshworks, bundles, or other structures, as by cross-linking."" [GOC:ai]",7
11,DT_score_c45,HP,HP:0100803,"['HP:0001597', 'HP:0011356']",0.00030555238959823844,An abnormality of the region around the nails of the fingers or toes.,5
12,DT_score_c45,GO:BP,GO:0045104,"['GO:0007010', 'GO:0045103']",0.0003566570654144749,"""A process that is carried out at the cellular level which results in the assembly, arrangement of constituent parts, or disassembly of cytoskeletal structures comprising intermediate filaments and their associated proteins."" [GOC:ai]",7
13,DT_score_c45,GO:BP,GO:0045103,['GO:0009987'],0.0003836991693906161,"""Any cellular process that depends upon or alters the intermediate filament cytoskeleton, that part of the cytoskeleton comprising intermediate filaments and their associated proteins."" [GOC:ai]",7
14,DT_score_c45,GO:CC,GO:0005737,"['GO:0005622', 'GO:0110165']",0.00039804380480249575,"""The contents of a cell excluding the plasma membrane and nucleus, but including other subcellular structures."" [ISBN:0198547684]",74
15,DT_score_c45,HP,HP:0007446,"['HP:0033800', 'HP:0040211', 'HP:0100872']",0.0005575122369335183,A type of blistering that affects the skin of the palms of the hands and the soles of the feet.,4
16,DT_score_c45,HP,HP:0033800,['HP:0008066'],0.000589210764333806,Blistering (presence of multiple fluid filled blisters) categorized according to the body site where they occur.,5
17,DT_score_c45,GO:CC,GO:0045095,['GO:0005882'],0.0010459545458998954,"""A filament composed of acidic and basic keratins (types I and II), typically expressed in epithelial cells. The keratins are the most diverse classes of IF proteins, with a large number of keratin isoforms being expressed. Each type of epithelium always expresses a characteristic combination of type I and type II keratins."" [ISBN:0716731363]",6
18,DT_score_c45,HP,HP:0012035,['HP:0008069'],0.001186620351353351,"Multiple, localized or widespread, asymptomatic or inflammatory dermal cysts involving the pilosebaceous units. Lesions can appear anywhere on the body, but steatocystoma multiplex is more commonly involved with those areas of the skin with a high density of developed pilosebaceous units (e.g., the axilla, groin, neck, and proximal extremities).",3
19,DT_score_c45,HP,HP:0025248,['HP:0025245'],0.001186620351353351,"A cutaneous cyst that is small (one or two millimeters in diameter) and painless, presenting as a follicular papule that usually is skin colored but may have a reddish or brownish tinge.",3
20,DT_score_c45,GO:BP,GO:0043588,['GO:0048513'],0.002635419634795672,"""The process whose specific outcome is the progression of the skin over time, from its formation to the mature structure. The skin is the external membranous integument of an animal. In vertebrates the skin generally consists of two layers, an outer nonsensitive and nonvascular epidermis (cuticle or skarfskin) composed of cells which are constantly growing and multiplying in the deeper, and being thrown off in the superficial layers, as well as an inner vascular dermis (cutis, corium or true skin) composed mostly of connective tissue."" [GOC:jl, UBERON:0002097]",10
21,DT_score_c45,HP,HP:0030268,['HP:0011842'],0.0029535309144984373,"Increased growth of callus, the bony and cartilaginous material that forms a connecting bridge across a bone fracture during fracture healing.",3
22,DT_score_c45,HP,HP:0007490,['HP:0000962'],0.0029535309144984373,Linear arrays of macular hyperkeratoses in flexural areas,3
23,DT_score_c45,HP,HP:0200040,['HP:0025245'],0.0030058897581095334,"Nontender, round and firm, but slightly compressible, intradermal or subcutaneous cyst measuring 0.5-5 cm in diameter. Epidermal cysts are intradermal or subcutaneous tumors, grow slowly and occur on the face, neck, back and scrotum. They usually appear at or around puberty, and as a rule an affected individual has one solitary or a few cysts.",4
24,DT_score_c45,GO:BP,GO:0031424,"['GO:0030216', 'GO:0032501']",0.003180004616245822,"""The process in which the cytoplasm of the outermost cells of the vertebrate epidermis is replaced by keratin. Keratinization occurs in the stratum corneum, feathers, hair, claws, nails, hooves, and horns."" [GOC:dph, GOC:ebc, GOC:sdb_2009, GOC:tb]",6
25,DT_score_c45,REAC,REAC:R-HSA-6805567,['REAC:R-HSA-1266738'],0.003376125598578275,Keratinization,9
26,DT_score_c45,GO:BP,GO:0009888,['GO:0048856'],0.005754556012420591,"""The process whose specific outcome is the progression of a tissue over time, from its formation to the mature structure."" [ISBN:0471245208]",24
27,DT_score_c45,HP,HP:0001609,['HP:0001608'],0.006029974183414283,"Hoarseness refers to a change in the pitch or quality of the voice, with the voice sounding weak, very breathy, scratchy, or husky.",7
28,DT_score_c45,HP,HP:0008066,['HP:0011121'],0.006795602405174619,"The presence of one or more bullae on the skin, defined as fluid-filled blisters more than 5 mm in diameter with thin walls.",7
29,DT_score_c45,GO:BP,GO:0030855,"['GO:0030154', 'GO:0060429']",0.006811776474156253,"""The process in which a relatively unspecialized cell acquires specialized features of an epithelial cell, any of the cells making up an epithelium."" [GOC:ecd, PMID:11839751]",14
30,DT_score_c45,GO:BP,GO:0060429,['GO:0009888'],0.008278080194677098,"""The process whose specific outcome is the progression of an epithelium over time, from its formation to the mature structure. An epithelium is a tissue that covers the internal or external surfaces of an anatomical structure."" [GOC:dph, GOC:mtg_lung]",18
31,DT_score_c45,HP,HP:0000962,['HP:0011368'],0.009894201740217613,"Hyperkeratosis is thickening of the outer layer of the skin, the stratum corneum, which is composed of large, polyhedral, plate-like envelopes filled with keratin which are the dead cells that have migrated up from the stratum granulosum.",9
32,DT_score_c45,HP,HP:0008401,['HP:0001805'],0.010246835650453293,Thickened toenails.,3
33,DT_score_c45,GO:CC,GO:0005882,"['GO:0045111', 'GO:0099513']",0.01096021623761865,"""A cytoskeletal structure that forms a distinct elongated structure, characteristically 10 nm in diameter, that occurs in the cytoplasm of eukaryotic cells. Intermediate filaments form a fibrous system, composed of chemically heterogeneous subunits and involved in mechanically integrating the various components of the cytoplasmic space. Intermediate filaments may be divided into five chemically distinct classes: Type I, acidic keratins; Type II, basic keratins; Type III, including desmin, vimentin and others; Type IV, neurofilaments and related filaments; and Type V, lamins."" [http://www.cytochemistry.net/Cell-biology/intermediate_filaments.htm, ISBN:0198506732]",7
34,DT_score_c45,HP,HP:0025245,['HP:0011355'],0.011757392662119434,A hollow mass located in the skin that is surrounded by an epithelium-lined wall and is well demarcated from the adjacent tissue. Cysts are often said to be sac-like and may contain serous liquid or semisolid material.,4
35,DT_score_c45,HP,HP:0000972,"['HP:0007556', 'HP:0010765']",0.011950124857321267,Abnormal thickening of the skin localized to the palm of the hand and the sole of the foot.,7
36,DT_score_c45,HPA,HPA:0471393,['HPA:0471392'],0.012614783518593221,skin 2; cells in basal layer[High],10
37,DT_score_c45,HP,HP:0007556,"['HP:0000962', 'HP:0100872']",0.013296666467274211,Hyperkeratosis affecting the sole of the foot.,7
38,DT_score_c45,HP,HP:0010765,"['HP:0000962', 'HP:0040211']",0.013296666467274211,Abnormal thickening of the skin localized to the palm of the hand.,7
39,DT_score_c45,HPA,HPA:0471401,['HPA:0470000'],0.014795491483770622,skin 2; cells in corneal layer[≥Low],7
40,DT_score_c45,HPA,HPA:0461451,['HPA:0460000'],0.01542958368517426,skin 1; hair follicles[≥Low],11
41,DT_score_c45,GO:BP,GO:0008544,['GO:0009888'],0.015932515456802326,"""The process whose specific outcome is the progression of the epidermis over time, from its formation to the mature structure. The epidermis is the outer epithelial layer of an animal, it may be a single layer that produces an extracellular material (e.g. the cuticle of arthropods) or a complex stratified squamous epithelium, as in the case of many vertebrate species."" [GOC:go_curators, UBERON:0001003]",10
42,DT_score_c45,HPA,HPA:0461402,['HPA:0461401'],0.023306825076547917,skin 1; cells in corneal layer[≥Medium],5
43,DT_score_c45,GO:BP,GO:0030216,"['GO:0009913', 'GO:0043588']",0.02414513186445816,"""The process in which a relatively unspecialized cell acquires specialized features of a keratinocyte."" [GOC:dph, GOC:mah, GOC:sdb_2009, GOC:tb]",7
44,DT_score_c45,HP,HP:0040036,['HP:0001805'],0.02437711154438729,Thickened fingernails.,3
45,DT_score_c45,GO:CC,GO:0045111,['GO:0005856'],0.02866696814490068,"""Cytoskeletal structure made from intermediate filaments, typically organized in the cytosol as an extended system that stretches from the nuclear envelope to the plasma membrane. Some intermediate filaments run parallel to the cell surface, while others traverse the cytosol; together they form an internal framework that helps support the shape and resilience of the cell."" [ISBN:0716731363]",7
46,DT_score_c45,HP,HP:0008404,['HP:0001597'],0.03071109693330144,Onychodystrophy (nail dystrophy) refers to nail changes apart from changes of the color (nail dyschromia) and involves partial or complete disruption of the various keratinous layers of the nail plate.,7
47,DT_score_c45,KEGG,KEGG:00790,['KEGG:00000'],0.03286444699559426,Folate biosynthesis,3
48,DT_score_c45,GO:CC,GO:0031012,['GO:0030312'],0.033020969353470965,"""A structure lying external to one or more cells, which provides structural support, biochemical or biomechanical cues for cells or tissues."" [GOC:BHF, GOC:mah, GOC:rph, NIF_Subcellular:nlx_subcell_20090513, PMID:21123617, PMID:28089324]",10
49,DT_score_c45,GO:CC,GO:0030312,"['GO:0071944', 'GO:0110165']",0.03351040014941486,"""A structure that lies outside the plasma membrane and surrounds the entire cell or cells. This does not include the periplasmic space."" [GOC:go_curators]",10
50,DT_score_c45,GO:CC,GO:0035580,"['GO:0034774', 'GO:0042581']",0.03669654156092125,"""The volume enclosed by the membrane of a specific granule, a granule with a membranous, tubular internal structure, found primarily in mature neutrophil cells. Most are released into the extracellular fluid. Specific granules contain lactoferrin, lysozyme, vitamin B12 binding protein and elastase."" [GOC:bf, PMID:7334549]",4
51,DT_score_c45,HP,HP:0001805,['HP:0001597'],0.036983540851281395,Nail that appears thick when viewed on end.,4
52,DT_score_c45,WP,WP:WP5390,['WP:000000'],0.040150681297419624,Pancreatic cancer subtypes,4
53,DT_score_c45,HP,HP:0030318,['HP:0100825'],0.04746452829873899,A type of inflammation of the lips involving one or both of the corners of the mouth.,3
54,RandomForest_gini,GO:CC,GO:0005615,"['GO:0005576', 'GO:0110165']",2.914336962961315e-14,"""That part of a multicellular organism outside the cells proper, usually taken to be outside the plasma membranes, and occupied by fluid."" [ISBN:0198547684]",49
55,RandomForest_gini,GO:CC,GO:0005576,['GO:0110165'],4.443835578129272e-12,"""The space external to the outermost structure of a cell. For cells without external protective or external encapsulating structures this refers to space outside of the plasma membrane. This term covers the host cell environment outside an intracellular parasite."" [GOC:go_curators]",52
56,RandomForest_gini,GO:CC,GO:0070062,"['GO:0005615', 'GO:1903561']",6.541478666989714e-12,"""A vesicle that is released into the extracellular region by fusion of the limiting endosomal membrane of a multivesicular body with the plasma membrane. Extracellular exosomes, also simply called exosomes, have a diameter of about 40-100 nm."" [GOC:BHF, GOC:mah, GOC:vesicles, PMID:15908444, PMID:17641064, PMID:19442504, PMID:19498381, PMID:22418571, PMID:24009894]",37
57,RandomForest_gini,GO:CC,GO:1903561,"['GO:0031982', 'GO:0065010']",9.317230388969045e-12,"""Any vesicle that is part of the extracellular region."" [GO_REF:0000064, GOC:pm, GOC:TermGenie, PMID:24769233]",37
58,RandomForest_gini,GO:CC,GO:0043230,"['GO:0005576', 'GO:0043226']",9.454560663716733e-12,"""Organized structure of distinctive morphology and function, occurring outside the cell. Includes, for example, extracellular membrane vesicles (EMVs) and the cellulosomes of anaerobic bacteria and fungi."" [GOC:jl, PMID:9914479]",37
59,RandomForest_gini,GO:CC,GO:0065010,"['GO:0043227', 'GO:0043230']",9.454560663716733e-12,"""Organized structure of distinctive morphology and function, bounded by a lipid bilayer membrane and occurring outside the cell."" [GOC:isa_complete]",37
60,RandomForest_gini,GO:CC,GO:0031982,['GO:0043227'],3.204555077770471e-10,"""Any small, fluid-filled, spherical organelle enclosed by membrane."" [GOC:mah, GOC:pz, GOC:vesicles]",48
61,RandomForest_gini,HPA,HPA:0641532,['HPA:0641531'],3.429245398628848e-08,endometrium; stromal fibroblasts[≥Medium],8
62,RandomForest_gini,HPA,HPA:0641531,['HPA:0640000'],1.0363586437460232e-07,endometrium; stromal fibroblasts[≥Low],8
63,RandomForest_gini,GO:CC,GO:0062023,['GO:0031012'],1.2120513570004189e-07,"""An extracellular matrix consisting mainly of proteins (especially collagen) and glycosaminoglycans (mostly as proteoglycans) that provides not only essential physical scaffolding for the cellular constituents but can also initiate crucial biochemical and biomechanical cues required for tissue morphogenesis, differentiation and homeostasis. The components are secreted by cells in the vicinity and form a sheet underlying or overlying cells such as endothelial and epithelial cells."" [GOC:BHF, GOC:rph, PMID:21123617]",15
64,RandomForest_gini,HPA,HPA:0641533,['HPA:0641532'],1.532228253602047e-07,endometrium; stromal fibroblasts[High],7
65,RandomForest_gini,GO:CC,GO:0031012,['GO:0030312'],5.640631780053176e-07,"""A structure lying external to one or more cells, which provides structural support, biochemical or biomechanical cues for cells or tissues."" [GOC:BHF, GOC:mah, GOC:rph, NIF_Subcellular:nlx_subcell_20090513, PMID:21123617, PMID:28089324]",16
66,RandomForest_gini,GO:CC,GO:0030312,"['GO:0071944', 'GO:0110165']",5.787639537460151e-07,"""A structure that lies outside the plasma membrane and surrounds the entire cell or cells. This does not include the periplasmic space."" [GOC:go_curators]",16
67,RandomForest_gini,GO:CC,GO:0012505,['GO:0110165'],7.651192807356788e-07,"""A collection of membranous structures involved in transport within the cell. The main components of the endomembrane system are endoplasmic reticulum, Golgi bodies, vesicles, cell membrane and nuclear envelope. Members of the endomembrane system pass materials through each other or though the use of vesicles."" [GOC:lh]",47
68,RandomForest_gini,GO:BP,GO:0001568,"['GO:0001944', 'GO:0048856']",1.4994538501044456e-06,"""The process whose specific outcome is the progression of a blood vessel over time, from its formation to the mature structure. The blood vessel is the vasculature carrying blood."" [GOC:hjd, UBERON:0001981]",19
69,RandomForest_gini,GO:CC,GO:0071944,['GO:0110165'],1.9650455307062845e-06,"""The broad region around and including the plasma membrane of a cell, encompassing the cell cortex (inside the cell), the plasma membrane, and any external encapsulating structures."" [GOC:pdt]",54
70,RandomForest_gini,GO:BP,GO:0001944,"['GO:0048731', 'GO:0072359']",3.0118433418427305e-06,"""The process whose specific outcome is the progression of the vasculature over time, from its formation to the mature structure. The vasculature is an interconnected tubular multi-tissue structure that contains fluid that is actively transported around the organism."" [GOC:dph, UBERON:0002409]",19
71,RandomForest_gini,GO:BP,GO:0035239,"['GO:0009653', 'GO:0035295']",5.4841300260015645e-06,"""The process in which the anatomical structures of a tube are generated and organized. Epithelial and endothelial tubes transport gases, liquids and cells from one site to another and form the basic structure of many organs and tissues, with tube shape and organization varying from the single-celled excretory organ in Caenorhabditis elegans to the branching trees of the mammalian kidney and insect tracheal system."" [GOC:bf, PMID:14624839]",20
72,RandomForest_gini,GO:CC,GO:0034366,['GO:0034364'],6.210827205946541e-06,"""A mature high-density lipoprotein (HDL) particle, converted from discoidal HDL particles following the esterification of cholesterol in the particle by phosphatidylcholine-sterol O-acyltransferase (lecithin cholesterol acyltransferase; LCAT)."" [GOC:BHF, GOC:expert_pt, GOC:mah, GOC:rl]",4
73,RandomForest_gini,GO:BP,GO:0035295,"['GO:0007275', 'GO:0048856']",8.21099091594555e-06,"""The process whose specific outcome is the progression of a tube over time, from its initial formation to a mature structure. Epithelial and endothelial tubes transport gases, liquids and cells from one site to another and form the basic structure of many organs and tissues including lung and trachea, kidney, the mammary gland, the vascular system and the gastrointestinal and urinary-genital tracts."" [PMID:12526790]",22
74,RandomForest_gini,GO:BP,GO:0048514,"['GO:0001568', 'GO:0035239']",8.355647266731675e-06,"""The process in which the anatomical structures of blood vessels are generated and organized. The blood vessel is the vasculature carrying blood."" [GOC:jid]",17
75,RandomForest_gini,GO:BP,GO:0009653,"['GO:0032502', 'GO:0048856']",8.630624165512605e-06,"""The process in which anatomical structures are generated and organized. Morphogenesis pertains to the creation of form."" [GOC:go_curators, ISBN:0521436125]",35
76,RandomForest_gini,HPA,HPA:0640000,['HPA:0000000'],9.232185547133057e-06,endometrium,9
77,RandomForest_gini,REAC,REAC:R-HSA-3000480,['REAC:R-HSA-2173782'],2.5647399056317572e-05,Scavenging by Class A Receptors,5
78,RandomForest_gini,HPA,HPA:0640691,['HPA:0640000'],2.7068100504244944e-05,endometrium; smooth muscle cells[≥Low],7
79,RandomForest_gini,GO:CC,GO:0034364,['GO:0034358'],3.4003361332201145e-05,"""A lipoprotein particle with a high density (typically 1.063-1.21 g/ml) and a diameter of 5-10 nm that contains APOAs and may contain APOCs and APOE; found in blood and carries lipids from body tissues to the liver as part of the reverse cholesterol transport process."" [GOC:BHF, GOC:expert_pt, GOC:mah, GOC:pde, GOC:rl]",5
80,RandomForest_gini,GO:BP,GO:0048646,"['GO:0009653', 'GO:0032502']",3.568708113599089e-05,"""The developmental process pertaining to the initial formation of an anatomical structure from unspecified parts. This process begins with the specific processes that contribute to the appearance of the discrete structure and ends when the structural rudiment is recognizable. An anatomical structure is any biological entity that occupies space and is distinguished from its surroundings. Anatomical structures can be macroscopic such as a carpel, or microscopic such as an acrosome."" [GOC:dph, GOC:jid, GOC:tb]",22
81,RandomForest_gini,GO:CC,GO:0072562,"['GO:0005615', 'GO:0110165']",3.7840198380568175e-05,"""A phospholipid microvesicle that is derived from any of several cell types, such as platelets, blood cells, endothelial cells, or others, and contains membrane receptors as well as other proteins characteristic of the parental cell. Microparticles are heterogeneous in size, and are characterized as microvesicles free of nucleic acids."" [GOC:BHF, GOC:mah, PMID:16373184]",8
82,RandomForest_gini,GO:BP,GO:0072359,['GO:0048731'],8.172805528574991e-05,"""The process whose specific outcome is the progression of the circulatory system over time, from its formation to the mature structure. The circulatory system is the organ system that passes nutrients (such as amino acids and electrolytes), gases, hormones, blood cells, etc. to and from cells in the body to help fight diseases and help stabilize body temperature and pH to maintain homeostasis."" [GOC:mah, UBERON:0001009]",21
83,RandomForest_gini,GO:MF,GO:0048407,['GO:0019838'],0.00011448870174252966,"""Binding to platelet-derived growth factor."" [GOC:dgh]",4
84,RandomForest_gini,GO:CC,GO:0031410,"['GO:0005737', 'GO:0097708']",0.00013701753349562161,"""A vesicle found in the cytoplasm of a cell."" [GOC:ai, GOC:mah, GOC:vesicles]",29
85,RandomForest_gini,GO:CC,GO:0097708,"['GO:0031982', 'GO:0043231']",0.00014285034715984932,"""Any vesicle that is part of the intracellular region."" [GOC:vesicles]",29
86,RandomForest_gini,GO:CC,GO:1990777,['GO:0032994'],0.00016780385763977374,"""A spherical particle containing non-covalently associated proteins and lipids. Examples are plasma lipoprotein particles which transport lipids in the blood or lymph."" [GOC:vesicles]",5
87,RandomForest_gini,GO:CC,GO:0034358,"['GO:0005615', 'GO:1990777']",0.00016780385763977374,"""A spherical particle with a hydrophobic core of triglycerides and/or cholesterol esters, surrounded by an amphipathic monolayer of phospholipids, cholesterol and apolipoproteins. Plasma lipoprotein particles transport lipids, which are non-covalently associated with the particles, in the blood or lymph."" [GOC:BHF, GOC:expert_pt, GOC:rl]",5
88,RandomForest_gini,GO:CC,GO:0032994,['GO:0032991'],0.000247964927346323,"""A macromolecular complex containing separate protein and lipid molecules. Separate in this context means not covalently bound to each other."" [GOC:mah]",5
89,RandomForest_gini,GO:MF,GO:0038085,['GO:0019838'],0.00030508258569018535,"""Binding to a vascular endothelial growth factor."" [PMID:17470632]",3
90,RandomForest_gini,HPA,HPA:0640203,['HPA:0640202'],0.0003423552815089785,endometrium; endothelial cells[High],5
91,RandomForest_gini,GO:BP,GO:0001525,"['GO:0048514', 'GO:0048646']",0.0003941441742184307,"""Blood vessel formation when new vessels emerge from the proliferation of pre-existing blood vessels."" [ISBN:0878932453]",14
92,RandomForest_gini,GO:CC,GO:0099503,['GO:0031410'],0.0008655365262752527,"""A cytoplasmic, membrane bound vesicle that is capable of fusing to the plasma membrane to release its contents into the extracellular space."" [GOC:dos]",17
93,RandomForest_gini,GO:BP,GO:0009719,['GO:0050896'],0.0009890419076568474,"""Any process that results in a change in state or activity of a cell or an organism (in terms of movement, secretion, enzyme production, gene expression, etc.) as a result of a stimulus arising within the organism."" [GOC:sm]",24
94,RandomForest_gini,GO:BP,GO:0048731,"['GO:0007275', 'GO:0048856']",0.0020191296202722126,"""The process whose specific outcome is the progression of an organismal system over time, from its formation to the mature structure. A system is a regularly interacting or interdependent group of organs or tissues that work together to carry out a given biological process."" [GOC:dph, GOC:jid]",39
